source,date,title,summary,text,filtered,normalized,tokens_word,tokens_sentence,tokens_tweet,tokens_clean,lemmas,stems_porter,stems_snowball
New York Times,2026-04-27,"Fighting ‘Sacred’ War in Ukraine, North Korea and Russia Pledge to Deepen Ties","The two countries discussed long-term military cooperation, as they opened a memorial for North Korean troops killed in Russia’s war in Ukraine.","Fighting ‘Sacred’ War in Ukraine, North Korea and Russia Pledge to Deepen Ties The two countries discussed long-term military cooperation, as they opened a memorial for North Korean troops killed in Russia’s war in Ukraine.",Fighting Sacred War in Ukraine North Korea and Russia Pledge to Deepen Ties The two countries discussed long-term military cooperation as they opened a memorial for North Korean troops killed in Russia s war in Ukraine,fighting sacred war in ukraine north korea and russia pledge to deepen ties the two countries discussed long-term military cooperation as they opened a memorial for north korean troops killed in russia s war in ukraine,"['fighting', 'sacred', 'war', 'in', 'ukraine', 'north', 'korea', 'and', 'russia', 'pledge', 'to', 'deepen', 'ties', 'the', 'two', 'countries', 'discussed', 'long-term', 'military', 'cooperation', 'as', 'they', 'opened', 'a', 'memorial', 'for', 'north', 'korean', 'troops', 'killed', 'in', 'russia', 's', 'war', 'in', 'ukraine']",['Fighting Sacred War in Ukraine North Korea and Russia Pledge to Deepen Ties The two countries discussed long-term military cooperation as they opened a memorial for North Korean troops killed in Russia s war in Ukraine'],"['fighting', 'sacred', 'war', 'in', 'ukraine', 'north', 'korea', 'and', 'russia', 'pledge', 'to', 'deepen', 'ties', 'the', 'two', 'countries', 'discussed', 'long-term', 'military', 'cooperation', 'as', 'they', 'opened', 'a', 'memorial', 'for', 'north', 'korean', 'troops', 'killed', 'in', 'russia', 's', 'war', 'in', 'ukraine']","['fighting', 'sacred', 'war', 'ukraine', 'north', 'korea', 'russia', 'pledge', 'deepen', 'ties', 'two', 'countries', 'discussed', 'military', 'cooperation', 'opened', 'memorial', 'north', 'korean', 'troops', 'killed', 'russia', 'war', 'ukraine']","['fighting', 'sacred', 'war', 'ukraine', 'north', 'korea', 'russia', 'pledge', 'deepen', 'tie', 'two', 'country', 'discussed', 'military', 'cooperation', 'opened', 'memorial', 'north', 'korean', 'troop', 'killed', 'russia', 'war', 'ukraine']","['fight', 'sacr', 'war', 'ukrain', 'north', 'korea', 'russia', 'pledg', 'deepen', 'tie', 'two', 'countri', 'discuss', 'militari', 'cooper', 'open', 'memori', 'north', 'korean', 'troop', 'kill', 'russia', 'war', 'ukrain']","['fight', 'sacr', 'war', 'ukrain', 'north', 'korea', 'russia', 'pledg', 'deepen', 'tie', 'two', 'countri', 'discuss', 'militari', 'cooper', 'open', 'memori', 'north', 'korean', 'troop', 'kill', 'russia', 'war', 'ukrain']"
New York Times,2026-04-27,"Iran War Shakes Global Economy, but the U.S. Has Mostly Been Spared","In just eight weeks, much of the global economy has been knocked sideways. America has mostly been spared from the tumult.","Iran War Shakes Global Economy, but the U.S. Has Mostly Been Spared In just eight weeks, much of the global economy has been knocked sideways. America has mostly been spared from the tumult.",Iran War Shakes Global Economy but the U S Has Mostly Been Spared In just eight weeks much of the global economy has been knocked sideways America has mostly been spared from the tumult,iran war shakes global economy but the u s has mostly been spared in just eight weeks much of the global economy has been knocked sideways america has mostly been spared from the tumult,"['iran', 'war', 'shakes', 'global', 'economy', 'but', 'the', 'u', 's', 'has', 'mostly', 'been', 'spared', 'in', 'just', 'eight', 'weeks', 'much', 'of', 'the', 'global', 'economy', 'has', 'been', 'knocked', 'sideways', 'america', 'has', 'mostly', 'been', 'spared', 'from', 'the', 'tumult']",['Iran War Shakes Global Economy but the U S Has Mostly Been Spared In just eight weeks much of the global economy has been knocked sideways America has mostly been spared from the tumult'],"['iran', 'war', 'shakes', 'global', 'economy', 'but', 'the', 'u', 's', 'has', 'mostly', 'been', 'spared', 'in', 'just', 'eight', 'weeks', 'much', 'of', 'the', 'global', 'economy', 'has', 'been', 'knocked', 'sideways', 'america', 'has', 'mostly', 'been', 'spared', 'from', 'the', 'tumult']","['iran', 'war', 'shakes', 'global', 'economy', 'mostly', 'spared', 'eight', 'weeks', 'much', 'global', 'economy', 'knocked', 'sideways', 'america', 'mostly', 'spared', 'tumult']","['iran', 'war', 'shake', 'global', 'economy', 'mostly', 'spared', 'eight', 'week', 'much', 'global', 'economy', 'knocked', 'sideways', 'america', 'mostly', 'spared', 'tumult']","['iran', 'war', 'shake', 'global', 'economi', 'mostli', 'spare', 'eight', 'week', 'much', 'global', 'economi', 'knock', 'sideway', 'america', 'mostli', 'spare', 'tumult']","['iran', 'war', 'shake', 'global', 'economi', 'most', 'spare', 'eight', 'week', 'much', 'global', 'economi', 'knock', 'sideway', 'america', 'most', 'spare', 'tumult']"
New York Times,2026-04-27,Canada Says Its Gold Is Traceable and Clean. So We Traced It.,We ended up in a Colombian mine controlled by a drug cartel.,Canada Says Its Gold Is Traceable and Clean. So We Traced It. We ended up in a Colombian mine controlled by a drug cartel.,Canada Says Its Gold Is Traceable and Clean So We Traced It We ended up in a Colombian mine controlled by a drug cartel,canada says its gold is traceable and clean so we traced it we ended up in a colombian mine controlled by a drug cartel,"['canada', 'says', 'its', 'gold', 'is', 'traceable', 'and', 'clean', 'so', 'we', 'traced', 'it', 'we', 'ended', 'up', 'in', 'a', 'colombian', 'mine', 'controlled', 'by', 'a', 'drug', 'cartel']",['Canada Says Its Gold Is Traceable and Clean So We Traced It We ended up in a Colombian mine controlled by a drug cartel'],"['canada', 'says', 'its', 'gold', 'is', 'traceable', 'and', 'clean', 'so', 'we', 'traced', 'it', 'we', 'ended', 'up', 'in', 'a', 'colombian', 'mine', 'controlled', 'by', 'a', 'drug', 'cartel']","['canada', 'says', 'gold', 'traceable', 'clean', 'traced', 'ended', 'colombian', 'mine', 'controlled', 'drug', 'cartel']","['canada', 'say', 'gold', 'traceable', 'clean', 'traced', 'ended', 'colombian', 'mine', 'controlled', 'drug', 'cartel']","['canada', 'say', 'gold', 'traceabl', 'clean', 'trace', 'end', 'colombian', 'mine', 'control', 'drug', 'cartel']","['canada', 'say', 'gold', 'traceabl', 'clean', 'trace', 'end', 'colombian', 'mine', 'control', 'drug', 'cartel']"
New York Times,2026-04-27,Homeowners Fight for Control of Their Community in China,"Residents signed petitions, organized rallies and held strategy sessions over karaoke, debating how far to push the authorities in their dispute with a developer.","Homeowners Fight for Control of Their Community in China Residents signed petitions, organized rallies and held strategy sessions over karaoke, debating how far to push the authorities in their dispute with a developer.",Homeowners Fight for Control of Their Community in China Residents signed petitions organized rallies and held strategy sessions over karaoke debating how far to push the authorities in their dispute with a developer,homeowners fight for control of their community in china residents signed petitions organized rallies and held strategy sessions over karaoke debating how far to push the authorities in their dispute with a developer,"['homeowners', 'fight', 'for', 'control', 'of', 'their', 'community', 'in', 'china', 'residents', 'signed', 'petitions', 'organized', 'rallies', 'and', 'held', 'strategy', 'sessions', 'over', 'karaoke', 'debating', 'how', 'far', 'to', 'push', 'the', 'authorities', 'in', 'their', 'dispute', 'with', 'a', 'developer']",['Homeowners Fight for Control of Their Community in China Residents signed petitions organized rallies and held strategy sessions over karaoke debating how far to push the authorities in their dispute with a developer'],"['homeowners', 'fight', 'for', 'control', 'of', 'their', 'community', 'in', 'china', 'residents', 'signed', 'petitions', 'organized', 'rallies', 'and', 'held', 'strategy', 'sessions', 'over', 'karaoke', 'debating', 'how', 'far', 'to', 'push', 'the', 'authorities', 'in', 'their', 'dispute', 'with', 'a', 'developer']","['homeowners', 'fight', 'control', 'community', 'china', 'residents', 'signed', 'petitions', 'organized', 'rallies', 'held', 'strategy', 'sessions', 'karaoke', 'debating', 'far', 'push', 'authorities', 'dispute', 'developer']","['homeowner', 'fight', 'control', 'community', 'china', 'resident', 'signed', 'petition', 'organized', 'rally', 'held', 'strategy', 'session', 'karaoke', 'debating', 'far', 'push', 'authority', 'dispute', 'developer']","['homeown', 'fight', 'control', 'commun', 'china', 'resid', 'sign', 'petit', 'organ', 'ralli', 'held', 'strategi', 'session', 'karaok', 'debat', 'far', 'push', 'author', 'disput', 'develop']","['homeown', 'fight', 'control', 'communiti', 'china', 'resid', 'sign', 'petit', 'organ', 'ralli', 'held', 'strategi', 'session', 'karaok', 'debat', 'far', 'push', 'author', 'disput', 'develop']"
New York Times,2026-04-27,Mali Terror Attack: Defense Minister Killed by Al Qaeda-Linked JNIM,"The death of the defense minister, Gen. Sadio Camara, a central figure in the country’s military government, comes amid escalating violence in the region.","Mali Terror Attack: Defense Minister Killed by Al Qaeda-Linked JNIM The death of the defense minister, Gen. Sadio Camara, a central figure in the country’s military government, comes amid escalating violence in the region.",Mali Terror Attack Defense Minister Killed by Al Qaeda-Linked JNIM The death of the defense minister Gen Sadio Camara a central figure in the country s military government comes amid escalating violence in the region,mali terror attack defense minister killed by al qaeda-linked jnim the death of the defense minister gen sadio camara a central figure in the country s military government comes amid escalating violence in the region,"['mali', 'terror', 'attack', 'defense', 'minister', 'killed', 'by', 'al', 'qaeda-linked', 'jnim', 'the', 'death', 'of', 'the', 'defense', 'minister', 'gen', 'sadio', 'camara', 'a', 'central', 'figure', 'in', 'the', 'country', 's', 'military', 'government', 'comes', 'amid', 'escalating', 'violence', 'in', 'the', 'region']",['Mali Terror Attack Defense Minister Killed by Al Qaeda-Linked JNIM The death of the defense minister Gen Sadio Camara a central figure in the country s military government comes amid escalating violence in the region'],"['mali', 'terror', 'attack', 'defense', 'minister', 'killed', 'by', 'al', 'qaeda-linked', 'jnim', 'the', 'death', 'of', 'the', 'defense', 'minister', 'gen', 'sadio', 'camara', 'a', 'central', 'figure', 'in', 'the', 'country', 's', 'military', 'government', 'comes', 'amid', 'escalating', 'violence', 'in', 'the', 'region']","['mali', 'terror', 'attack', 'defense', 'minister', 'killed', 'jnim', 'death', 'defense', 'minister', 'gen', 'sadio', 'camara', 'central', 'figure', 'country', 'military', 'government', 'comes', 'amid', 'escalating', 'violence', 'region']","['mali', 'terror', 'attack', 'defense', 'minister', 'killed', 'jnim', 'death', 'defense', 'minister', 'gen', 'sadio', 'camara', 'central', 'figure', 'country', 'military', 'government', 'come', 'amid', 'escalating', 'violence', 'region']","['mali', 'terror', 'attack', 'defens', 'minist', 'kill', 'jnim', 'death', 'defens', 'minist', 'gen', 'sadio', 'camara', 'central', 'figur', 'countri', 'militari', 'govern', 'come', 'amid', 'escal', 'violenc', 'region']","['mali', 'terror', 'attack', 'defens', 'minist', 'kill', 'jnim', 'death', 'defens', 'minist', 'gen', 'sadio', 'camara', 'central', 'figur', 'countri', 'militari', 'govern', 'come', 'amid', 'escal', 'violenc', 'region']"
New York Times,2026-04-27,"U.S. Military Strikes Another Boat in Eastern Pacific, Killing 3",The United States has carried out dozens of boat strikes since September against people the Trump administration accuses of smuggling drugs.,"U.S. Military Strikes Another Boat in Eastern Pacific, Killing 3 The United States has carried out dozens of boat strikes since September against people the Trump administration accuses of smuggling drugs.",U S Military Strikes Another Boat in Eastern Pacific Killing The United States has carried out dozens of boat strikes since September against people the Trump administration accuses of smuggling drugs,u s military strikes another boat in eastern pacific killing the united states has carried out dozens of boat strikes since september against people the trump administration accuses of smuggling drugs,"['u', 's', 'military', 'strikes', 'another', 'boat', 'in', 'eastern', 'pacific', 'killing', 'the', 'united', 'states', 'has', 'carried', 'out', 'dozens', 'of', 'boat', 'strikes', 'since', 'september', 'against', 'people', 'the', 'trump', 'administration', 'accuses', 'of', 'smuggling', 'drugs']",['U S Military Strikes Another Boat in Eastern Pacific Killing The United States has carried out dozens of boat strikes since September against people the Trump administration accuses of smuggling drugs'],"['u', 's', 'military', 'strikes', 'another', 'boat', 'in', 'eastern', 'pacific', 'killing', 'the', 'united', 'states', 'has', 'carried', 'out', 'dozens', 'of', 'boat', 'strikes', 'since', 'september', 'against', 'people', 'the', 'trump', 'administration', 'accuses', 'of', 'smuggling', 'drugs']","['military', 'strikes', 'another', 'boat', 'eastern', 'pacific', 'killing', 'united', 'states', 'carried', 'dozens', 'boat', 'strikes', 'since', 'september', 'people', 'trump', 'administration', 'accuses', 'smuggling', 'drugs']","['military', 'strike', 'another', 'boat', 'eastern', 'pacific', 'killing', 'united', 'state', 'carried', 'dozen', 'boat', 'strike', 'since', 'september', 'people', 'trump', 'administration', 'accuses', 'smuggling', 'drug']","['militari', 'strike', 'anoth', 'boat', 'eastern', 'pacif', 'kill', 'unit', 'state', 'carri', 'dozen', 'boat', 'strike', 'sinc', 'septemb', 'peopl', 'trump', 'administr', 'accus', 'smuggl', 'drug']","['militari', 'strike', 'anoth', 'boat', 'eastern', 'pacif', 'kill', 'unit', 'state', 'carri', 'dozen', 'boat', 'strike', 'sinc', 'septemb', 'peopl', 'trump', 'administr', 'accus', 'smuggl', 'drug']"
New York Times,2026-04-27,King Charles Is Coming to the U.S. at a Very Delicate Time,"Not since his mother, Queen Elizabeth II, traveled to Washington after the Suez Crisis has a visit by the British monarch come at such a fraught point in Anglo-American relations.","King Charles Is Coming to the U.S. at a Very Delicate Time Not since his mother, Queen Elizabeth II, traveled to Washington after the Suez Crisis has a visit by the British monarch come at such a fraught point in Anglo-American relations.",King Charles Is Coming to the U S at a Very Delicate Time Not since his mother Queen Elizabeth II traveled to Washington after the Suez Crisis has a visit by the British monarch come at such a fraught point in Anglo-American relations,king charles is coming to the u s at a very delicate time not since his mother queen elizabeth ii traveled to washington after the suez crisis has a visit by the british monarch come at such a fraught point in anglo-american relations,"['king', 'charles', 'is', 'coming', 'to', 'the', 'u', 's', 'at', 'a', 'very', 'delicate', 'time', 'not', 'since', 'his', 'mother', 'queen', 'elizabeth', 'ii', 'traveled', 'to', 'washington', 'after', 'the', 'suez', 'crisis', 'has', 'a', 'visit', 'by', 'the', 'british', 'monarch', 'come', 'at', 'such', 'a', 'fraught', 'point', 'in', 'anglo-american', 'relations']",['King Charles Is Coming to the U S at a Very Delicate Time Not since his mother Queen Elizabeth II traveled to Washington after the Suez Crisis has a visit by the British monarch come at such a fraught point in Anglo-American relations'],"['king', 'charles', 'is', 'coming', 'to', 'the', 'u', 's', 'at', 'a', 'very', 'delicate', 'time', 'not', 'since', 'his', 'mother', 'queen', 'elizabeth', 'ii', 'traveled', 'to', 'washington', 'after', 'the', 'suez', 'crisis', 'has', 'a', 'visit', 'by', 'the', 'british', 'monarch', 'come', 'at', 'such', 'a', 'fraught', 'point', 'in', 'anglo-american', 'relations']","['king', 'charles', 'coming', 'delicate', 'time', 'since', 'mother', 'queen', 'elizabeth', 'traveled', 'washington', 'suez', 'crisis', 'visit', 'british', 'monarch', 'come', 'fraught', 'point', 'relations']","['king', 'charles', 'coming', 'delicate', 'time', 'since', 'mother', 'queen', 'elizabeth', 'traveled', 'washington', 'suez', 'crisis', 'visit', 'british', 'monarch', 'come', 'fraught', 'point', 'relation']","['king', 'charl', 'come', 'delic', 'time', 'sinc', 'mother', 'queen', 'elizabeth', 'travel', 'washington', 'suez', 'crisi', 'visit', 'british', 'monarch', 'come', 'fraught', 'point', 'relat']","['king', 'charl', 'come', 'delic', 'time', 'sinc', 'mother', 'queen', 'elizabeth', 'travel', 'washington', 'suez', 'crisi', 'visit', 'british', 'monarch', 'come', 'fraught', 'point', 'relat']"
New York Times,2026-04-28,8 Memorable Moments From Past British Royal Visits to the U.S.,"With King Charles III and Queen Camilla set to arrive for a state visit with President Trump, we look back at some major moments in previous royal trips to the United States.","8 Memorable Moments From Past British Royal Visits to the U.S. With King Charles III and Queen Camilla set to arrive for a state visit with President Trump, we look back at some major moments in previous royal trips to the United States.",Memorable Moments From Past British Royal Visits to the U S With King Charles III and Queen Camilla set to arrive for a state visit with President Trump we look back at some major moments in previous royal trips to the United States,memorable moments from past british royal visits to the u s with king charles iii and queen camilla set to arrive for a state visit with president trump we look back at some major moments in previous royal trips to the united states,"['memorable', 'moments', 'from', 'past', 'british', 'royal', 'visits', 'to', 'the', 'u', 's', 'with', 'king', 'charles', 'iii', 'and', 'queen', 'camilla', 'set', 'to', 'arrive', 'for', 'a', 'state', 'visit', 'with', 'president', 'trump', 'we', 'look', 'back', 'at', 'some', 'major', 'moments', 'in', 'previous', 'royal', 'trips', 'to', 'the', 'united', 'states']",['Memorable Moments From Past British Royal Visits to the U S With King Charles III and Queen Camilla set to arrive for a state visit with President Trump we look back at some major moments in previous royal trips to the United States'],"['memorable', 'moments', 'from', 'past', 'british', 'royal', 'visits', 'to', 'the', 'u', 's', 'with', 'king', 'charles', 'iii', 'and', 'queen', 'camilla', 'set', 'to', 'arrive', 'for', 'a', 'state', 'visit', 'with', 'president', 'trump', 'we', 'look', 'back', 'at', 'some', 'major', 'moments', 'in', 'previous', 'royal', 'trips', 'to', 'the', 'united', 'states']","['memorable', 'moments', 'past', 'british', 'royal', 'visits', 'king', 'charles', 'iii', 'queen', 'camilla', 'set', 'arrive', 'state', 'visit', 'president', 'trump', 'look', 'back', 'major', 'moments', 'previous', 'royal', 'trips', 'united', 'states']","['memorable', 'moment', 'past', 'british', 'royal', 'visit', 'king', 'charles', 'iii', 'queen', 'camilla', 'set', 'arrive', 'state', 'visit', 'president', 'trump', 'look', 'back', 'major', 'moment', 'previous', 'royal', 'trip', 'united', 'state']","['memor', 'moment', 'past', 'british', 'royal', 'visit', 'king', 'charl', 'iii', 'queen', 'camilla', 'set', 'arriv', 'state', 'visit', 'presid', 'trump', 'look', 'back', 'major', 'moment', 'previou', 'royal', 'trip', 'unit', 'state']","['memor', 'moment', 'past', 'british', 'royal', 'visit', 'king', 'charl', 'iii', 'queen', 'camilla', 'set', 'arriv', 'state', 'visit', 'presid', 'trump', 'look', 'back', 'major', 'moment', 'previous', 'royal', 'trip', 'unit', 'state']"
New York Times,2026-04-27,The Rising Chinese Automaker Not Named BYD,"Geely is challenging the giant BYD by adapting quickly to swings in demand and energy prices, seizing on interest in electric vehicles prompted by the war in Iran.","The Rising Chinese Automaker Not Named BYD Geely is challenging the giant BYD by adapting quickly to swings in demand and energy prices, seizing on interest in electric vehicles prompted by the war in Iran.",The Rising Chinese Automaker Not Named BYD Geely is challenging the giant BYD by adapting quickly to swings in demand and energy prices seizing on interest in electric vehicles prompted by the war in Iran,the rising chinese automaker not named byd geely is challenging the giant byd by adapting quickly to swings in demand and energy prices seizing on interest in electric vehicles prompted by the war in iran,"['the', 'rising', 'chinese', 'automaker', 'not', 'named', 'byd', 'geely', 'is', 'challenging', 'the', 'giant', 'byd', 'by', 'adapting', 'quickly', 'to', 'swings', 'in', 'demand', 'and', 'energy', 'prices', 'seizing', 'on', 'interest', 'in', 'electric', 'vehicles', 'prompted', 'by', 'the', 'war', 'in', 'iran']",['The Rising Chinese Automaker Not Named BYD Geely is challenging the giant BYD by adapting quickly to swings in demand and energy prices seizing on interest in electric vehicles prompted by the war in Iran'],"['the', 'rising', 'chinese', 'automaker', 'not', 'named', 'byd', 'geely', 'is', 'challenging', 'the', 'giant', 'byd', 'by', 'adapting', 'quickly', 'to', 'swings', 'in', 'demand', 'and', 'energy', 'prices', 'seizing', 'on', 'interest', 'in', 'electric', 'vehicles', 'prompted', 'by', 'the', 'war', 'in', 'iran']","['rising', 'chinese', 'automaker', 'named', 'byd', 'geely', 'challenging', 'giant', 'byd', 'adapting', 'quickly', 'swings', 'demand', 'energy', 'prices', 'seizing', 'interest', 'electric', 'vehicles', 'prompted', 'war', 'iran']","['rising', 'chinese', 'automaker', 'named', 'byd', 'geely', 'challenging', 'giant', 'byd', 'adapting', 'quickly', 'swing', 'demand', 'energy', 'price', 'seizing', 'interest', 'electric', 'vehicle', 'prompted', 'war', 'iran']","['rise', 'chines', 'automak', 'name', 'byd', 'geeli', 'challeng', 'giant', 'byd', 'adapt', 'quickli', 'swing', 'demand', 'energi', 'price', 'seiz', 'interest', 'electr', 'vehicl', 'prompt', 'war', 'iran']","['rise', 'chines', 'automak', 'name', 'byd', 'geeli', 'challeng', 'giant', 'byd', 'adapt', 'quick', 'swing', 'demand', 'energi', 'price', 'seiz', 'interest', 'electr', 'vehicl', 'prompt', 'war', 'iran']"
New York Times,2026-04-27,How a Trump Event Shooting Unfolded,"The gunman had written a “manifesto,” the president said, before trying to enter a dinner in Washington for the White House press corps.","How a Trump Event Shooting Unfolded The gunman had written a “manifesto,” the president said, before trying to enter a dinner in Washington for the White House press corps.",How a Trump Event Shooting Unfolded The gunman had written a manifesto the president said before trying to enter a dinner in Washington for the White House press corps,how a trump event shooting unfolded the gunman had written a manifesto the president said before trying to enter a dinner in washington for the white house press corps,"['how', 'a', 'trump', 'event', 'shooting', 'unfolded', 'the', 'gunman', 'had', 'written', 'a', 'manifesto', 'the', 'president', 'said', 'before', 'trying', 'to', 'enter', 'a', 'dinner', 'in', 'washington', 'for', 'the', 'white', 'house', 'press', 'corps']",['How a Trump Event Shooting Unfolded The gunman had written a manifesto the president said before trying to enter a dinner in Washington for the White House press corps'],"['how', 'a', 'trump', 'event', 'shooting', 'unfolded', 'the', 'gunman', 'had', 'written', 'a', 'manifesto', 'the', 'president', 'said', 'before', 'trying', 'to', 'enter', 'a', 'dinner', 'in', 'washington', 'for', 'the', 'white', 'house', 'press', 'corps']","['trump', 'event', 'shooting', 'unfolded', 'gunman', 'written', 'manifesto', 'president', 'said', 'trying', 'enter', 'dinner', 'washington', 'white', 'house', 'press', 'corps']","['trump', 'event', 'shooting', 'unfolded', 'gunman', 'written', 'manifesto', 'president', 'said', 'trying', 'enter', 'dinner', 'washington', 'white', 'house', 'press', 'corp']","['trump', 'event', 'shoot', 'unfold', 'gunman', 'written', 'manifesto', 'presid', 'said', 'tri', 'enter', 'dinner', 'washington', 'white', 'hous', 'press', 'corp']","['trump', 'event', 'shoot', 'unfold', 'gunman', 'written', 'manifesto', 'presid', 'said', 'tri', 'enter', 'dinner', 'washington', 'white', 'hous', 'press', 'corp']"
