source,date,title,summary,text,filtered,normalized,tokens_word,tokens_sentence,tokens_tweet,tokens_clean,lemmas,stems_porter,stems_snowball
The Guardian,2026-04-28,Humanoid robots to become baggage handlers in Japan airport experiment,"Japan Airlines will introduce the robots for trial run at a Tokyo airport amid country’s surge in inbound tourism and worsening labour shortagesJapan’s famously conscientious but overburdened baggage handlers will soon be joined by extra staff at Tokyo’s Haneda airport – although their new colleagues will need to take regular recharging breaks.Japan Airlines will introduce humanoid robots on a trial basis from the beginning of May, with a view to deploying them permanently as a solution to the country’s chronic labour shortage. Continue reading...","Humanoid robots to become baggage handlers in Japan airport experiment Japan Airlines will introduce the robots for trial run at a Tokyo airport amid country’s surge in inbound tourism and worsening labour shortagesJapan’s famously conscientious but overburdened baggage handlers will soon be joined by extra staff at Tokyo’s Haneda airport – although their new colleagues will need to take regular recharging breaks.Japan Airlines will introduce humanoid robots on a trial basis from the beginning of May, with a view to deploying them permanently as a solution to the country’s chronic labour shortage. Continue reading...",Humanoid robots to become baggage handlers in Japan airport experiment Japan Airlines will introduce the robots for trial run at a Tokyo airport amid country s surge in inbound tourism and worsening labour shortagesJapan s famously conscientious but overburdened baggage handlers will soon be joined by extra staff at Tokyo s Haneda airport although their new colleagues will need to take regular recharging breaks Japan Airlines will introduce humanoid robots on a trial basis from the beginning of May with a view to deploying them permanently as a solution to the country s chronic labour shortage Continue reading,humanoid robots to become baggage handlers in japan airport experiment japan airlines will introduce the robots for trial run at a tokyo airport amid country s surge in inbound tourism and worsening labour shortagesjapan s famously conscientious but overburdened baggage handlers will soon be joined by extra staff at tokyo s haneda airport although their new colleagues will need to take regular recharging breaks japan airlines will introduce humanoid robots on a trial basis from the beginning of may with a view to deploying them permanently as a solution to the country s chronic labour shortage continue reading,"['humanoid', 'robots', 'to', 'become', 'baggage', 'handlers', 'in', 'japan', 'airport', 'experiment', 'japan', 'airlines', 'will', 'introduce', 'the', 'robots', 'for', 'trial', 'run', 'at', 'a', 'tokyo', 'airport', 'amid', 'country', 's', 'surge', 'in', 'inbound', 'tourism', 'and', 'worsening', 'labour', 'shortagesjapan', 's', 'famously', 'conscientious', 'but', 'overburdened', 'baggage', 'handlers', 'will', 'soon', 'be', 'joined', 'by', 'extra', 'staff', 'at', 'tokyo', 's', 'haneda', 'airport', 'although', 'their', 'new', 'colleagues', 'will', 'need', 'to', 'take', 'regular', 'recharging', 'breaks', 'japan', 'airlines', 'will', 'introduce', 'humanoid', 'robots', 'on', 'a', 'trial', 'basis', 'from', 'the', 'beginning', 'of', 'may', 'with', 'a', 'view', 'to', 'deploying', 'them', 'permanently', 'as', 'a', 'solution', 'to', 'the', 'country', 's', 'chronic', 'labour', 'shortage', 'continue', 'reading']",['Humanoid robots to become baggage handlers in Japan airport experiment Japan Airlines will introduce the robots for trial run at a Tokyo airport amid country s surge in inbound tourism and worsening labour shortagesJapan s famously conscientious but overburdened baggage handlers will soon be joined by extra staff at Tokyo s Haneda airport although their new colleagues will need to take regular recharging breaks Japan Airlines will introduce humanoid robots on a trial basis from the beginning of May with a view to deploying them permanently as a solution to the country s chronic labour shortage Continue reading'],"['humanoid', 'robots', 'to', 'become', 'baggage', 'handlers', 'in', 'japan', 'airport', 'experiment', 'japan', 'airlines', 'will', 'introduce', 'the', 'robots', 'for', 'trial', 'run', 'at', 'a', 'tokyo', 'airport', 'amid', 'country', 's', 'surge', 'in', 'inbound', 'tourism', 'and', 'worsening', 'labour', 'shortagesjapan', 's', 'famously', 'conscientious', 'but', 'overburdened', 'baggage', 'handlers', 'will', 'soon', 'be', 'joined', 'by', 'extra', 'staff', 'at', 'tokyo', 's', 'haneda', 'airport', 'although', 'their', 'new', 'colleagues', 'will', 'need', 'to', 'take', 'regular', 'recharging', 'breaks', 'japan', 'airlines', 'will', 'introduce', 'humanoid', 'robots', 'on', 'a', 'trial', 'basis', 'from', 'the', 'beginning', 'of', 'may', 'with', 'a', 'view', 'to', 'deploying', 'them', 'permanently', 'as', 'a', 'solution', 'to', 'the', 'country', 's', 'chronic', 'labour', 'shortage', 'continue', 'reading']","['humanoid', 'robots', 'become', 'baggage', 'handlers', 'japan', 'airport', 'experiment', 'japan', 'airlines', 'introduce', 'robots', 'trial', 'run', 'tokyo', 'airport', 'amid', 'country', 'surge', 'inbound', 'tourism', 'worsening', 'labour', 'shortagesjapan', 'famously', 'conscientious', 'overburdened', 'baggage', 'handlers', 'soon', 'joined', 'extra', 'staff', 'tokyo', 'haneda', 'airport', 'although', 'new', 'colleagues', 'need', 'take', 'regular', 'recharging', 'breaks', 'japan', 'airlines', 'introduce', 'humanoid', 'robots', 'trial', 'basis', 'beginning', 'may', 'view', 'deploying', 'permanently', 'solution', 'country', 'chronic', 'labour', 'shortage', 'continue', 'reading']","['humanoid', 'robot', 'become', 'baggage', 'handler', 'japan', 'airport', 'experiment', 'japan', 'airline', 'introduce', 'robot', 'trial', 'run', 'tokyo', 'airport', 'amid', 'country', 'surge', 'inbound', 'tourism', 'worsening', 'labour', 'shortagesjapan', 'famously', 'conscientious', 'overburdened', 'baggage', 'handler', 'soon', 'joined', 'extra', 'staff', 'tokyo', 'haneda', 'airport', 'although', 'new', 'colleague', 'need', 'take', 'regular', 'recharging', 'break', 'japan', 'airline', 'introduce', 'humanoid', 'robot', 'trial', 'basis', 'beginning', 'may', 'view', 'deploying', 'permanently', 'solution', 'country', 'chronic', 'labour', 'shortage', 'continue', 'reading']","['humanoid', 'robot', 'becom', 'baggag', 'handler', 'japan', 'airport', 'experi', 'japan', 'airlin', 'introduc', 'robot', 'trial', 'run', 'tokyo', 'airport', 'amid', 'countri', 'surg', 'inbound', 'tourism', 'worsen', 'labour', 'shortagesjapan', 'famous', 'conscienti', 'overburden', 'baggag', 'handler', 'soon', 'join', 'extra', 'staff', 'tokyo', 'haneda', 'airport', 'although', 'new', 'colleagu', 'need', 'take', 'regular', 'recharg', 'break', 'japan', 'airlin', 'introduc', 'humanoid', 'robot', 'trial', 'basi', 'begin', 'may', 'view', 'deploy', 'perman', 'solut', 'countri', 'chronic', 'labour', 'shortag', 'continu', 'read']","['humanoid', 'robot', 'becom', 'baggag', 'handler', 'japan', 'airport', 'experi', 'japan', 'airlin', 'introduc', 'robot', 'trial', 'run', 'tokyo', 'airport', 'amid', 'countri', 'surg', 'inbound', 'tourism', 'worsen', 'labour', 'shortagesjapan', 'famous', 'conscienti', 'overburden', 'baggag', 'handler', 'soon', 'join', 'extra', 'staff', 'tokyo', 'haneda', 'airport', 'although', 'new', 'colleagu', 'need', 'take', 'regular', 'recharg', 'break', 'japan', 'airlin', 'introduc', 'humanoid', 'robot', 'trial', 'basi', 'begin', 'may', 'view', 'deploy', 'perman', 'solut', 'countri', 'chronic', 'labour', 'shortag', 'continu', 'read']"
The Guardian,2026-04-28,Train collision in Indonesia kills 14 as rescuers work to reach survivors,"Efforts continue to free two trapped passengers in wreckage after long-distance train collides with commuter train outside Jakarta, injuring 81The death toll from a train collision near the Indonesian capital Jakarta has risen to 14 with another 84 injured, the train operator said on Tuesday, as rescuers worked to extract survivors still trapped in the wreckage.The collision between a commuter train and a long-distance train happened late on Monday in Bekasi, just outside Jakarta. Continue reading...","Train collision in Indonesia kills 14 as rescuers work to reach survivors Efforts continue to free two trapped passengers in wreckage after long-distance train collides with commuter train outside Jakarta, injuring 81The death toll from a train collision near the Indonesian capital Jakarta has risen to 14 with another 84 injured, the train operator said on Tuesday, as rescuers worked to extract survivors still trapped in the wreckage.The collision between a commuter train and a long-distance train happened late on Monday in Bekasi, just outside Jakarta. Continue reading...",Train collision in Indonesia kills as rescuers work to reach survivors Efforts continue to free two trapped passengers in wreckage after long-distance train collides with commuter train outside Jakarta injuring The death toll from a train collision near the Indonesian capital Jakarta has risen to with another injured the train operator said on Tuesday as rescuers worked to extract survivors still trapped in the wreckage The collision between a commuter train and a long-distance train happened late on Monday in Bekasi just outside Jakarta Continue reading,train collision in indonesia kills as rescuers work to reach survivors efforts continue to free two trapped passengers in wreckage after long-distance train collides with commuter train outside jakarta injuring the death toll from a train collision near the indonesian capital jakarta has risen to with another injured the train operator said on tuesday as rescuers worked to extract survivors still trapped in the wreckage the collision between a commuter train and a long-distance train happened late on monday in bekasi just outside jakarta continue reading,"['train', 'collision', 'in', 'indonesia', 'kills', 'as', 'rescuers', 'work', 'to', 'reach', 'survivors', 'efforts', 'continue', 'to', 'free', 'two', 'trapped', 'passengers', 'in', 'wreckage', 'after', 'long-distance', 'train', 'collides', 'with', 'commuter', 'train', 'outside', 'jakarta', 'injuring', 'the', 'death', 'toll', 'from', 'a', 'train', 'collision', 'near', 'the', 'indonesian', 'capital', 'jakarta', 'has', 'risen', 'to', 'with', 'another', 'injured', 'the', 'train', 'operator', 'said', 'on', 'tuesday', 'as', 'rescuers', 'worked', 'to', 'extract', 'survivors', 'still', 'trapped', 'in', 'the', 'wreckage', 'the', 'collision', 'between', 'a', 'commuter', 'train', 'and', 'a', 'long-distance', 'train', 'happened', 'late', 'on', 'monday', 'in', 'bekasi', 'just', 'outside', 'jakarta', 'continue', 'reading']",['Train collision in Indonesia kills as rescuers work to reach survivors Efforts continue to free two trapped passengers in wreckage after long-distance train collides with commuter train outside Jakarta injuring The death toll from a train collision near the Indonesian capital Jakarta has risen to with another injured the train operator said on Tuesday as rescuers worked to extract survivors still trapped in the wreckage The collision between a commuter train and a long-distance train happened late on Monday in Bekasi just outside Jakarta Continue reading'],"['train', 'collision', 'in', 'indonesia', 'kills', 'as', 'rescuers', 'work', 'to', 'reach', 'survivors', 'efforts', 'continue', 'to', 'free', 'two', 'trapped', 'passengers', 'in', 'wreckage', 'after', 'long-distance', 'train', 'collides', 'with', 'commuter', 'train', 'outside', 'jakarta', 'injuring', 'the', 'death', 'toll', 'from', 'a', 'train', 'collision', 'near', 'the', 'indonesian', 'capital', 'jakarta', 'has', 'risen', 'to', 'with', 'another', 'injured', 'the', 'train', 'operator', 'said', 'on', 'tuesday', 'as', 'rescuers', 'worked', 'to', 'extract', 'survivors', 'still', 'trapped', 'in', 'the', 'wreckage', 'the', 'collision', 'between', 'a', 'commuter', 'train', 'and', 'a', 'long-distance', 'train', 'happened', 'late', 'on', 'monday', 'in', 'bekasi', 'just', 'outside', 'jakarta', 'continue', 'reading']","['train', 'collision', 'indonesia', 'kills', 'rescuers', 'work', 'reach', 'survivors', 'efforts', 'continue', 'free', 'two', 'trapped', 'passengers', 'wreckage', 'train', 'collides', 'commuter', 'train', 'outside', 'jakarta', 'injuring', 'death', 'toll', 'train', 'collision', 'near', 'indonesian', 'capital', 'jakarta', 'risen', 'another', 'injured', 'train', 'operator', 'said', 'tuesday', 'rescuers', 'worked', 'extract', 'survivors', 'still', 'trapped', 'wreckage', 'collision', 'commuter', 'train', 'train', 'happened', 'late', 'monday', 'bekasi', 'outside', 'jakarta', 'continue', 'reading']","['train', 'collision', 'indonesia', 'kill', 'rescuer', 'work', 'reach', 'survivor', 'effort', 'continue', 'free', 'two', 'trapped', 'passenger', 'wreckage', 'train', 'collides', 'commuter', 'train', 'outside', 'jakarta', 'injuring', 'death', 'toll', 'train', 'collision', 'near', 'indonesian', 'capital', 'jakarta', 'risen', 'another', 'injured', 'train', 'operator', 'said', 'tuesday', 'rescuer', 'worked', 'extract', 'survivor', 'still', 'trapped', 'wreckage', 'collision', 'commuter', 'train', 'train', 'happened', 'late', 'monday', 'bekasi', 'outside', 'jakarta', 'continue', 'reading']","['train', 'collis', 'indonesia', 'kill', 'rescuer', 'work', 'reach', 'survivor', 'effort', 'continu', 'free', 'two', 'trap', 'passeng', 'wreckag', 'train', 'collid', 'commut', 'train', 'outsid', 'jakarta', 'injur', 'death', 'toll', 'train', 'collis', 'near', 'indonesian', 'capit', 'jakarta', 'risen', 'anoth', 'injur', 'train', 'oper', 'said', 'tuesday', 'rescuer', 'work', 'extract', 'survivor', 'still', 'trap', 'wreckag', 'collis', 'commut', 'train', 'train', 'happen', 'late', 'monday', 'bekasi', 'outsid', 'jakarta', 'continu', 'read']","['train', 'collis', 'indonesia', 'kill', 'rescuer', 'work', 'reach', 'survivor', 'effort', 'continu', 'free', 'two', 'trap', 'passeng', 'wreckag', 'train', 'collid', 'commut', 'train', 'outsid', 'jakarta', 'injur', 'death', 'toll', 'train', 'collis', 'near', 'indonesian', 'capit', 'jakarta', 'risen', 'anoth', 'injur', 'train', 'oper', 'said', 'tuesday', 'rescuer', 'work', 'extract', 'survivor', 'still', 'trap', 'wreckag', 'collis', 'commut', 'train', 'train', 'happen', 'late', 'monday', 'bekasi', 'outsid', 'jakarta', 'continu', 'read']"
The Guardian,2026-04-27,Number of executions in North Korea rose dramatically during Covid – report,"Regime used its isolation after closing borders to escalate killings when global scrutiny disappeared, NGO claimsNorth Korea dramatically increased its use of the death penalty after closing its borders during the Covid-19 pandemic, using its isolation to escalate killings when international scrutiny disappeared, according to a report mapping 13 years of executions under the country’s leader, Kim Jong-un.The number of documented cases of executions and death sentences increased by 117% in the nearly five years after North Korea sealed its borders in January 2020 compared with an equal period before the closure, according to a report by the Transitional Justice Working Group (TJWG), a human rights NGO in Seoul. Continue reading...","Number of executions in North Korea rose dramatically during Covid – report Regime used its isolation after closing borders to escalate killings when global scrutiny disappeared, NGO claimsNorth Korea dramatically increased its use of the death penalty after closing its borders during the Covid-19 pandemic, using its isolation to escalate killings when international scrutiny disappeared, according to a report mapping 13 years of executions under the country’s leader, Kim Jong-un.The number of documented cases of executions and death sentences increased by 117% in the nearly five years after North Korea sealed its borders in January 2020 compared with an equal period before the closure, according to a report by the Transitional Justice Working Group (TJWG), a human rights NGO in Seoul. Continue reading...",Number of executions in North Korea rose dramatically during Covid report Regime used its isolation after closing borders to escalate killings when global scrutiny disappeared NGO claimsNorth Korea dramatically increased its use of the death penalty after closing its borders during the Covid- pandemic using its isolation to escalate killings when international scrutiny disappeared according to a report mapping years of executions under the country s leader Kim Jong-un The number of documented cases of executions and death sentences increased by in the nearly five years after North Korea sealed its borders in January compared with an equal period before the closure according to a report by the Transitional Justice Working Group TJWG a human rights NGO in Seoul Continue reading,number of executions in north korea rose dramatically during covid report regime used its isolation after closing borders to escalate killings when global scrutiny disappeared ngo claimsnorth korea dramatically increased its use of the death penalty after closing its borders during the covid- pandemic using its isolation to escalate killings when international scrutiny disappeared according to a report mapping years of executions under the country s leader kim jong-un the number of documented cases of executions and death sentences increased by in the nearly five years after north korea sealed its borders in january compared with an equal period before the closure according to a report by the transitional justice working group tjwg a human rights ngo in seoul continue reading,"['number', 'of', 'executions', 'in', 'north', 'korea', 'rose', 'dramatically', 'during', 'covid', 'report', 'regime', 'used', 'its', 'isolation', 'after', 'closing', 'borders', 'to', 'escalate', 'killings', 'when', 'global', 'scrutiny', 'disappeared', 'ngo', 'claimsnorth', 'korea', 'dramatically', 'increased', 'its', 'use', 'of', 'the', 'death', 'penalty', 'after', 'closing', 'its', 'borders', 'during', 'the', 'covid-', 'pandemic', 'using', 'its', 'isolation', 'to', 'escalate', 'killings', 'when', 'international', 'scrutiny', 'disappeared', 'according', 'to', 'a', 'report', 'mapping', 'years', 'of', 'executions', 'under', 'the', 'country', 's', 'leader', 'kim', 'jong-un', 'the', 'number', 'of', 'documented', 'cases', 'of', 'executions', 'and', 'death', 'sentences', 'increased', 'by', 'in', 'the', 'nearly', 'five', 'years', 'after', 'north', 'korea', 'sealed', 'its', 'borders', 'in', 'january', 'compared', 'with', 'an', 'equal', 'period', 'before', 'the', 'closure', 'according', 'to', 'a', 'report', 'by', 'the', 'transitional', 'justice', 'working', 'group', 'tjwg', 'a', 'human', 'rights', 'ngo', 'in', 'seoul', 'continue', 'reading']",['Number of executions in North Korea rose dramatically during Covid report Regime used its isolation after closing borders to escalate killings when global scrutiny disappeared NGO claimsNorth Korea dramatically increased its use of the death penalty after closing its borders during the Covid- pandemic using its isolation to escalate killings when international scrutiny disappeared according to a report mapping years of executions under the country s leader Kim Jong-un The number of documented cases of executions and death sentences increased by in the nearly five years after North Korea sealed its borders in January compared with an equal period before the closure according to a report by the Transitional Justice Working Group TJWG a human rights NGO in Seoul Continue reading'],"['number', 'of', 'executions', 'in', 'north', 'korea', 'rose', 'dramatically', 'during', 'covid', 'report', 'regime', 'used', 'its', 'isolation', 'after', 'closing', 'borders', 'to', 'escalate', 'killings', 'when', 'global', 'scrutiny', 'disappeared', 'ngo', 'claimsnorth', 'korea', 'dramatically', 'increased', 'its', 'use', 'of', 'the', 'death', 'penalty', 'after', 'closing', 'its', 'borders', 'during', 'the', 'covid', '-', 'pandemic', 'using', 'its', 'isolation', 'to', 'escalate', 'killings', 'when', 'international', 'scrutiny', 'disappeared', 'according', 'to', 'a', 'report', 'mapping', 'years', 'of', 'executions', 'under', 'the', 'country', 's', 'leader', 'kim', 'jong-un', 'the', 'number', 'of', 'documented', 'cases', 'of', 'executions', 'and', 'death', 'sentences', 'increased', 'by', 'in', 'the', 'nearly', 'five', 'years', 'after', 'north', 'korea', 'sealed', 'its', 'borders', 'in', 'january', 'compared', 'with', 'an', 'equal', 'period', 'before', 'the', 'closure', 'according', 'to', 'a', 'report', 'by', 'the', 'transitional', 'justice', 'working', 'group', 'tjwg', 'a', 'human', 'rights', 'ngo', 'in', 'seoul', 'continue', 'reading']","['number', 'executions', 'north', 'korea', 'rose', 'dramatically', 'covid', 'report', 'regime', 'used', 'isolation', 'closing', 'borders', 'escalate', 'killings', 'global', 'scrutiny', 'disappeared', 'ngo', 'claimsnorth', 'korea', 'dramatically', 'increased', 'use', 'death', 'penalty', 'closing', 'borders', 'pandemic', 'using', 'isolation', 'escalate', 'killings', 'international', 'scrutiny', 'disappeared', 'according', 'report', 'mapping', 'years', 'executions', 'country', 'leader', 'kim', 'number', 'documented', 'cases', 'executions', 'death', 'sentences', 'increased', 'nearly', 'five', 'years', 'north', 'korea', 'sealed', 'borders', 'january', 'compared', 'equal', 'period', 'closure', 'according', 'report', 'transitional', 'justice', 'working', 'group', 'tjwg', 'human', 'rights', 'ngo', 'seoul', 'continue', 'reading']","['number', 'execution', 'north', 'korea', 'rose', 'dramatically', 'covid', 'report', 'regime', 'used', 'isolation', 'closing', 'border', 'escalate', 'killing', 'global', 'scrutiny', 'disappeared', 'ngo', 'claimsnorth', 'korea', 'dramatically', 'increased', 'use', 'death', 'penalty', 'closing', 'border', 'pandemic', 'using', 'isolation', 'escalate', 'killing', 'international', 'scrutiny', 'disappeared', 'according', 'report', 'mapping', 'year', 'execution', 'country', 'leader', 'kim', 'number', 'documented', 'case', 'execution', 'death', 'sentence', 'increased', 'nearly', 'five', 'year', 'north', 'korea', 'sealed', 'border', 'january', 'compared', 'equal', 'period', 'closure', 'according', 'report', 'transitional', 'justice', 'working', 'group', 'tjwg', 'human', 'right', 'ngo', 'seoul', 'continue', 'reading']","['number', 'execut', 'north', 'korea', 'rose', 'dramat', 'covid', 'report', 'regim', 'use', 'isol', 'close', 'border', 'escal', 'kill', 'global', 'scrutini', 'disappear', 'ngo', 'claimsnorth', 'korea', 'dramat', 'increas', 'use', 'death', 'penalti', 'close', 'border', 'pandem', 'use', 'isol', 'escal', 'kill', 'intern', 'scrutini', 'disappear', 'accord', 'report', 'map', 'year', 'execut', 'countri', 'leader', 'kim', 'number', 'document', 'case', 'execut', 'death', 'sentenc', 'increas', 'nearli', 'five', 'year', 'north', 'korea', 'seal', 'border', 'januari', 'compar', 'equal', 'period', 'closur', 'accord', 'report', 'transit', 'justic', 'work', 'group', 'tjwg', 'human', 'right', 'ngo', 'seoul', 'continu', 'read']","['number', 'execut', 'north', 'korea', 'rose', 'dramat', 'covid', 'report', 'regim', 'use', 'isol', 'close', 'border', 'escal', 'kill', 'global', 'scrutini', 'disappear', 'ngo', 'claimsnorth', 'korea', 'dramat', 'increas', 'use', 'death', 'penalti', 'close', 'border', 'pandem', 'use', 'isol', 'escal', 'kill', 'intern', 'scrutini', 'disappear', 'accord', 'report', 'map', 'year', 'execut', 'countri', 'leader', 'kim', 'number', 'document', 'case', 'execut', 'death', 'sentenc', 'increas', 'near', 'five', 'year', 'north', 'korea', 'seal', 'border', 'januari', 'compar', 'equal', 'period', 'closur', 'accord', 'report', 'transit', 'justic', 'work', 'group', 'tjwg', 'human', 'right', 'ngo', 'seoul', 'continu', 'read']"
