source,date,title,summary,text,filtered,normalized,tokens_word,tokens_sentence,tokens_tweet,tokens_clean,lemmas,stems_porter,stems_snowball
The Guardian,2026-04-28,How the UAE’s decision to leave Opec could recast the Middle East,"Defection is damaging to Saudi Arabia’s prestige – and could strengthen the US hand in the regionThe United Arab Emirates’ decision to walk out of Opec is a political as much as business decision, and will reignite the simmering rows between the UAE and Saudi Arabia – which had been covered up by their shared anger with Iran over its attacks on the Gulf states since the start of the US-Israel war on Tehran.In the short term, leaving the oil producing cartel it joined in 1967 gives the UAE the freedom to respond quickly to a long-term prospect of constrained supplies, and to maximise profit. But it is a decision the UAE has considered before, as UAE and Saudi tensions over production quotas have been longstanding. Continue reading...","How the UAE’s decision to leave Opec could recast the Middle East Defection is damaging to Saudi Arabia’s prestige – and could strengthen the US hand in the regionThe United Arab Emirates’ decision to walk out of Opec is a political as much as business decision, and will reignite the simmering rows between the UAE and Saudi Arabia – which had been covered up by their shared anger with Iran over its attacks on the Gulf states since the start of the US-Israel war on Tehran.In the short term, leaving the oil producing cartel it joined in 1967 gives the UAE the freedom to respond quickly to a long-term prospect of constrained supplies, and to maximise profit. But it is a decision the UAE has considered before, as UAE and Saudi tensions over production quotas have been longstanding. Continue reading...",How the UAE s decision to leave Opec could recast the Middle East Defection is damaging to Saudi Arabia s prestige and could strengthen the US hand in the regionThe United Arab Emirates decision to walk out of Opec is a political as much as business decision and will reignite the simmering rows between the UAE and Saudi Arabia which had been covered up by their shared anger with Iran over its attacks on the Gulf states since the start of the US-Israel war on Tehran In the short term leaving the oil producing cartel it joined in gives the UAE the freedom to respond quickly to a long-term prospect of constrained supplies and to maximise profit But it is a decision the UAE has considered before as UAE and Saudi tensions over production quotas have been longstanding Continue reading,how the uae s decision to leave opec could recast the middle east defection is damaging to saudi arabia s prestige and could strengthen the us hand in the regionthe united arab emirates decision to walk out of opec is a political as much as business decision and will reignite the simmering rows between the uae and saudi arabia which had been covered up by their shared anger with iran over its attacks on the gulf states since the start of the us-israel war on tehran in the short term leaving the oil producing cartel it joined in gives the uae the freedom to respond quickly to a long-term prospect of constrained supplies and to maximise profit but it is a decision the uae has considered before as uae and saudi tensions over production quotas have been longstanding continue reading,"['how', 'the', 'uae', 's', 'decision', 'to', 'leave', 'opec', 'could', 'recast', 'the', 'middle', 'east', 'defection', 'is', 'damaging', 'to', 'saudi', 'arabia', 's', 'prestige', 'and', 'could', 'strengthen', 'the', 'us', 'hand', 'in', 'the', 'regionthe', 'united', 'arab', 'emirates', 'decision', 'to', 'walk', 'out', 'of', 'opec', 'is', 'a', 'political', 'as', 'much', 'as', 'business', 'decision', 'and', 'will', 'reignite', 'the', 'simmering', 'rows', 'between', 'the', 'uae', 'and', 'saudi', 'arabia', 'which', 'had', 'been', 'covered', 'up', 'by', 'their', 'shared', 'anger', 'with', 'iran', 'over', 'its', 'attacks', 'on', 'the', 'gulf', 'states', 'since', 'the', 'start', 'of', 'the', 'us-israel', 'war', 'on', 'tehran', 'in', 'the', 'short', 'term', 'leaving', 'the', 'oil', 'producing', 'cartel', 'it', 'joined', 'in', 'gives', 'the', 'uae', 'the', 'freedom', 'to', 'respond', 'quickly', 'to', 'a', 'long-term', 'prospect', 'of', 'constrained', 'supplies', 'and', 'to', 'maximise', 'profit', 'but', 'it', 'is', 'a', 'decision', 'the', 'uae', 'has', 'considered', 'before', 'as', 'uae', 'and', 'saudi', 'tensions', 'over', 'production', 'quotas', 'have', 'been', 'longstanding', 'continue', 'reading']",['How the UAE s decision to leave Opec could recast the Middle East Defection is damaging to Saudi Arabia s prestige and could strengthen the US hand in the regionThe United Arab Emirates decision to walk out of Opec is a political as much as business decision and will reignite the simmering rows between the UAE and Saudi Arabia which had been covered up by their shared anger with Iran over its attacks on the Gulf states since the start of the US-Israel war on Tehran In the short term leaving the oil producing cartel it joined in gives the UAE the freedom to respond quickly to a long-term prospect of constrained supplies and to maximise profit But it is a decision the UAE has considered before as UAE and Saudi tensions over production quotas have been longstanding Continue reading'],"['how', 'the', 'uae', 's', 'decision', 'to', 'leave', 'opec', 'could', 'recast', 'the', 'middle', 'east', 'defection', 'is', 'damaging', 'to', 'saudi', 'arabia', 's', 'prestige', 'and', 'could', 'strengthen', 'the', 'us', 'hand', 'in', 'the', 'regionthe', 'united', 'arab', 'emirates', 'decision', 'to', 'walk', 'out', 'of', 'opec', 'is', 'a', 'political', 'as', 'much', 'as', 'business', 'decision', 'and', 'will', 'reignite', 'the', 'simmering', 'rows', 'between', 'the', 'uae', 'and', 'saudi', 'arabia', 'which', 'had', 'been', 'covered', 'up', 'by', 'their', 'shared', 'anger', 'with', 'iran', 'over', 'its', 'attacks', 'on', 'the', 'gulf', 'states', 'since', 'the', 'start', 'of', 'the', 'us-israel', 'war', 'on', 'tehran', 'in', 'the', 'short', 'term', 'leaving', 'the', 'oil', 'producing', 'cartel', 'it', 'joined', 'in', 'gives', 'the', 'uae', 'the', 'freedom', 'to', 'respond', 'quickly', 'to', 'a', 'long-term', 'prospect', 'of', 'constrained', 'supplies', 'and', 'to', 'maximise', 'profit', 'but', 'it', 'is', 'a', 'decision', 'the', 'uae', 'has', 'considered', 'before', 'as', 'uae', 'and', 'saudi', 'tensions', 'over', 'production', 'quotas', 'have', 'been', 'longstanding', 'continue', 'reading']","['uae', 'decision', 'leave', 'opec', 'could', 'recast', 'middle', 'east', 'defection', 'damaging', 'saudi', 'arabia', 'prestige', 'could', 'strengthen', 'hand', 'regionthe', 'united', 'arab', 'emirates', 'decision', 'walk', 'opec', 'political', 'much', 'business', 'decision', 'reignite', 'simmering', 'rows', 'uae', 'saudi', 'arabia', 'covered', 'shared', 'anger', 'iran', 'attacks', 'gulf', 'states', 'since', 'start', 'war', 'tehran', 'short', 'term', 'leaving', 'oil', 'producing', 'cartel', 'joined', 'gives', 'uae', 'freedom', 'respond', 'quickly', 'prospect', 'constrained', 'supplies', 'maximise', 'profit', 'decision', 'uae', 'considered', 'uae', 'saudi', 'tensions', 'production', 'quotas', 'longstanding', 'continue', 'reading']","['uae', 'decision', 'leave', 'opec', 'could', 'recast', 'middle', 'east', 'defection', 'damaging', 'saudi', 'arabia', 'prestige', 'could', 'strengthen', 'hand', 'regionthe', 'united', 'arab', 'emirate', 'decision', 'walk', 'opec', 'political', 'much', 'business', 'decision', 'reignite', 'simmering', 'row', 'uae', 'saudi', 'arabia', 'covered', 'shared', 'anger', 'iran', 'attack', 'gulf', 'state', 'since', 'start', 'war', 'tehran', 'short', 'term', 'leaving', 'oil', 'producing', 'cartel', 'joined', 'give', 'uae', 'freedom', 'respond', 'quickly', 'prospect', 'constrained', 'supply', 'maximise', 'profit', 'decision', 'uae', 'considered', 'uae', 'saudi', 'tension', 'production', 'quota', 'longstanding', 'continue', 'reading']","['uae', 'decis', 'leav', 'opec', 'could', 'recast', 'middl', 'east', 'defect', 'damag', 'saudi', 'arabia', 'prestig', 'could', 'strengthen', 'hand', 'regionth', 'unit', 'arab', 'emir', 'decis', 'walk', 'opec', 'polit', 'much', 'busi', 'decis', 'reignit', 'simmer', 'row', 'uae', 'saudi', 'arabia', 'cover', 'share', 'anger', 'iran', 'attack', 'gulf', 'state', 'sinc', 'start', 'war', 'tehran', 'short', 'term', 'leav', 'oil', 'produc', 'cartel', 'join', 'give', 'uae', 'freedom', 'respond', 'quickli', 'prospect', 'constrain', 'suppli', 'maximis', 'profit', 'decis', 'uae', 'consid', 'uae', 'saudi', 'tension', 'product', 'quota', 'longstand', 'continu', 'read']","['uae', 'decis', 'leav', 'opec', 'could', 'recast', 'middl', 'east', 'defect', 'damag', 'saudi', 'arabia', 'prestig', 'could', 'strengthen', 'hand', 'regionth', 'unit', 'arab', 'emir', 'decis', 'walk', 'opec', 'polit', 'much', 'busi', 'decis', 'reignit', 'simmer', 'row', 'uae', 'saudi', 'arabia', 'cover', 'share', 'anger', 'iran', 'attack', 'gulf', 'state', 'sinc', 'start', 'war', 'tehran', 'short', 'term', 'leav', 'oil', 'produc', 'cartel', 'join', 'give', 'uae', 'freedom', 'respond', 'quick', 'prospect', 'constrain', 'suppli', 'maximis', 'profit', 'decis', 'uae', 'consid', 'uae', 'saudi', 'tension', 'product', 'quota', 'longstand', 'continu', 'read']"
The Guardian,2026-04-28,Hezbollah drone strikes target Israeli soldiers in southern Lebanon,"Ceasefire frays further as Israel also carries out airstrikes and issues new displacement orders for south Lebanon Hezbollah launched several drones at Israeli soldiers in south Lebanon on Tuesday, while Israel issued new displacement orders for south Lebanon and carried out airstrikes, as the fraying ceasefire failed to stop fighting between the two sides.Hezbollah claimed Tuesday’s attack injured several Israeli soldiers, but no confirmation was given from the Israeli military, apart from a statement saying interceptor missiles had been fired at incoming Hezbollah drones. Continue reading...","Hezbollah drone strikes target Israeli soldiers in southern Lebanon Ceasefire frays further as Israel also carries out airstrikes and issues new displacement orders for south Lebanon Hezbollah launched several drones at Israeli soldiers in south Lebanon on Tuesday, while Israel issued new displacement orders for south Lebanon and carried out airstrikes, as the fraying ceasefire failed to stop fighting between the two sides.Hezbollah claimed Tuesday’s attack injured several Israeli soldiers, but no confirmation was given from the Israeli military, apart from a statement saying interceptor missiles had been fired at incoming Hezbollah drones. Continue reading...",Hezbollah drone strikes target Israeli soldiers in southern Lebanon Ceasefire frays further as Israel also carries out airstrikes and issues new displacement orders for south Lebanon Hezbollah launched several drones at Israeli soldiers in south Lebanon on Tuesday while Israel issued new displacement orders for south Lebanon and carried out airstrikes as the fraying ceasefire failed to stop fighting between the two sides Hezbollah claimed Tuesday s attack injured several Israeli soldiers but no confirmation was given from the Israeli military apart from a statement saying interceptor missiles had been fired at incoming Hezbollah drones Continue reading,hezbollah drone strikes target israeli soldiers in southern lebanon ceasefire frays further as israel also carries out airstrikes and issues new displacement orders for south lebanon hezbollah launched several drones at israeli soldiers in south lebanon on tuesday while israel issued new displacement orders for south lebanon and carried out airstrikes as the fraying ceasefire failed to stop fighting between the two sides hezbollah claimed tuesday s attack injured several israeli soldiers but no confirmation was given from the israeli military apart from a statement saying interceptor missiles had been fired at incoming hezbollah drones continue reading,"['hezbollah', 'drone', 'strikes', 'target', 'israeli', 'soldiers', 'in', 'southern', 'lebanon', 'ceasefire', 'frays', 'further', 'as', 'israel', 'also', 'carries', 'out', 'airstrikes', 'and', 'issues', 'new', 'displacement', 'orders', 'for', 'south', 'lebanon', 'hezbollah', 'launched', 'several', 'drones', 'at', 'israeli', 'soldiers', 'in', 'south', 'lebanon', 'on', 'tuesday', 'while', 'israel', 'issued', 'new', 'displacement', 'orders', 'for', 'south', 'lebanon', 'and', 'carried', 'out', 'airstrikes', 'as', 'the', 'fraying', 'ceasefire', 'failed', 'to', 'stop', 'fighting', 'between', 'the', 'two', 'sides', 'hezbollah', 'claimed', 'tuesday', 's', 'attack', 'injured', 'several', 'israeli', 'soldiers', 'but', 'no', 'confirmation', 'was', 'given', 'from', 'the', 'israeli', 'military', 'apart', 'from', 'a', 'statement', 'saying', 'interceptor', 'missiles', 'had', 'been', 'fired', 'at', 'incoming', 'hezbollah', 'drones', 'continue', 'reading']",['Hezbollah drone strikes target Israeli soldiers in southern Lebanon Ceasefire frays further as Israel also carries out airstrikes and issues new displacement orders for south Lebanon Hezbollah launched several drones at Israeli soldiers in south Lebanon on Tuesday while Israel issued new displacement orders for south Lebanon and carried out airstrikes as the fraying ceasefire failed to stop fighting between the two sides Hezbollah claimed Tuesday s attack injured several Israeli soldiers but no confirmation was given from the Israeli military apart from a statement saying interceptor missiles had been fired at incoming Hezbollah drones Continue reading'],"['hezbollah', 'drone', 'strikes', 'target', 'israeli', 'soldiers', 'in', 'southern', 'lebanon', 'ceasefire', 'frays', 'further', 'as', 'israel', 'also', 'carries', 'out', 'airstrikes', 'and', 'issues', 'new', 'displacement', 'orders', 'for', 'south', 'lebanon', 'hezbollah', 'launched', 'several', 'drones', 'at', 'israeli', 'soldiers', 'in', 'south', 'lebanon', 'on', 'tuesday', 'while', 'israel', 'issued', 'new', 'displacement', 'orders', 'for', 'south', 'lebanon', 'and', 'carried', 'out', 'airstrikes', 'as', 'the', 'fraying', 'ceasefire', 'failed', 'to', 'stop', 'fighting', 'between', 'the', 'two', 'sides', 'hezbollah', 'claimed', 'tuesday', 's', 'attack', 'injured', 'several', 'israeli', 'soldiers', 'but', 'no', 'confirmation', 'was', 'given', 'from', 'the', 'israeli', 'military', 'apart', 'from', 'a', 'statement', 'saying', 'interceptor', 'missiles', 'had', 'been', 'fired', 'at', 'incoming', 'hezbollah', 'drones', 'continue', 'reading']","['hezbollah', 'drone', 'strikes', 'target', 'israeli', 'soldiers', 'southern', 'lebanon', 'ceasefire', 'frays', 'israel', 'also', 'carries', 'airstrikes', 'issues', 'new', 'displacement', 'orders', 'south', 'lebanon', 'hezbollah', 'launched', 'several', 'drones', 'israeli', 'soldiers', 'south', 'lebanon', 'tuesday', 'israel', 'issued', 'new', 'displacement', 'orders', 'south', 'lebanon', 'carried', 'airstrikes', 'fraying', 'ceasefire', 'failed', 'stop', 'fighting', 'two', 'sides', 'hezbollah', 'claimed', 'tuesday', 'attack', 'injured', 'several', 'israeli', 'soldiers', 'confirmation', 'given', 'israeli', 'military', 'apart', 'statement', 'saying', 'interceptor', 'missiles', 'fired', 'incoming', 'hezbollah', 'drones', 'continue', 'reading']","['hezbollah', 'drone', 'strike', 'target', 'israeli', 'soldier', 'southern', 'lebanon', 'ceasefire', 'fray', 'israel', 'also', 'carry', 'airstrikes', 'issue', 'new', 'displacement', 'order', 'south', 'lebanon', 'hezbollah', 'launched', 'several', 'drone', 'israeli', 'soldier', 'south', 'lebanon', 'tuesday', 'israel', 'issued', 'new', 'displacement', 'order', 'south', 'lebanon', 'carried', 'airstrikes', 'fraying', 'ceasefire', 'failed', 'stop', 'fighting', 'two', 'side', 'hezbollah', 'claimed', 'tuesday', 'attack', 'injured', 'several', 'israeli', 'soldier', 'confirmation', 'given', 'israeli', 'military', 'apart', 'statement', 'saying', 'interceptor', 'missile', 'fired', 'incoming', 'hezbollah', 'drone', 'continue', 'reading']","['hezbollah', 'drone', 'strike', 'target', 'isra', 'soldier', 'southern', 'lebanon', 'ceasefir', 'fray', 'israel', 'also', 'carri', 'airstrik', 'issu', 'new', 'displac', 'order', 'south', 'lebanon', 'hezbollah', 'launch', 'sever', 'drone', 'isra', 'soldier', 'south', 'lebanon', 'tuesday', 'israel', 'issu', 'new', 'displac', 'order', 'south', 'lebanon', 'carri', 'airstrik', 'fray', 'ceasefir', 'fail', 'stop', 'fight', 'two', 'side', 'hezbollah', 'claim', 'tuesday', 'attack', 'injur', 'sever', 'isra', 'soldier', 'confirm', 'given', 'isra', 'militari', 'apart', 'statement', 'say', 'interceptor', 'missil', 'fire', 'incom', 'hezbollah', 'drone', 'continu', 'read']","['hezbollah', 'drone', 'strike', 'target', 'isra', 'soldier', 'southern', 'lebanon', 'ceasefir', 'fray', 'israel', 'also', 'carri', 'airstrik', 'issu', 'new', 'displac', 'order', 'south', 'lebanon', 'hezbollah', 'launch', 'sever', 'drone', 'isra', 'soldier', 'south', 'lebanon', 'tuesday', 'israel', 'issu', 'new', 'displac', 'order', 'south', 'lebanon', 'carri', 'airstrik', 'fray', 'ceasefir', 'fail', 'stop', 'fight', 'two', 'side', 'hezbollah', 'claim', 'tuesday', 'attack', 'injur', 'sever', 'isra', 'soldier', 'confirm', 'given', 'isra', 'militari', 'apart', 'statement', 'say', 'interceptor', 'missil', 'fire', 'incom', 'hezbollah', 'drone', 'continu', 'read']"
The Guardian,2026-04-28,UAE quits Opec in win for Trump as oil cartel weakened,"US president has accused organisation of ‘ripping off the rest of the world’ by inflating oil pricesThe United Arab Emirates has quit the Opec oil cartel after 60 years of membership, in a heavy blow to the group and its de facto leader, Saudi Arabia, as global energy markets contend with the biggest supply crisis in history.The shock loss of the UAE, Opec’s third-largest oil producer, is expected to weaken the group, which for decades has worked together to use its collective oil production to influence global oil market prices. Continue reading...","UAE quits Opec in win for Trump as oil cartel weakened US president has accused organisation of ‘ripping off the rest of the world’ by inflating oil pricesThe United Arab Emirates has quit the Opec oil cartel after 60 years of membership, in a heavy blow to the group and its de facto leader, Saudi Arabia, as global energy markets contend with the biggest supply crisis in history.The shock loss of the UAE, Opec’s third-largest oil producer, is expected to weaken the group, which for decades has worked together to use its collective oil production to influence global oil market prices. Continue reading...",UAE quits Opec in win for Trump as oil cartel weakened US president has accused organisation of ripping off the rest of the world by inflating oil pricesThe United Arab Emirates has quit the Opec oil cartel after years of membership in a heavy blow to the group and its de facto leader Saudi Arabia as global energy markets contend with the biggest supply crisis in history The shock loss of the UAE Opec s third-largest oil producer is expected to weaken the group which for decades has worked together to use its collective oil production to influence global oil market prices Continue reading,uae quits opec in win for trump as oil cartel weakened us president has accused organisation of ripping off the rest of the world by inflating oil pricesthe united arab emirates has quit the opec oil cartel after years of membership in a heavy blow to the group and its de facto leader saudi arabia as global energy markets contend with the biggest supply crisis in history the shock loss of the uae opec s third-largest oil producer is expected to weaken the group which for decades has worked together to use its collective oil production to influence global oil market prices continue reading,"['uae', 'quits', 'opec', 'in', 'win', 'for', 'trump', 'as', 'oil', 'cartel', 'weakened', 'us', 'president', 'has', 'accused', 'organisation', 'of', 'ripping', 'off', 'the', 'rest', 'of', 'the', 'world', 'by', 'inflating', 'oil', 'pricesthe', 'united', 'arab', 'emirates', 'has', 'quit', 'the', 'opec', 'oil', 'cartel', 'after', 'years', 'of', 'membership', 'in', 'a', 'heavy', 'blow', 'to', 'the', 'group', 'and', 'its', 'de', 'facto', 'leader', 'saudi', 'arabia', 'as', 'global', 'energy', 'markets', 'contend', 'with', 'the', 'biggest', 'supply', 'crisis', 'in', 'history', 'the', 'shock', 'loss', 'of', 'the', 'uae', 'opec', 's', 'third-largest', 'oil', 'producer', 'is', 'expected', 'to', 'weaken', 'the', 'group', 'which', 'for', 'decades', 'has', 'worked', 'together', 'to', 'use', 'its', 'collective', 'oil', 'production', 'to', 'influence', 'global', 'oil', 'market', 'prices', 'continue', 'reading']",['UAE quits Opec in win for Trump as oil cartel weakened US president has accused organisation of ripping off the rest of the world by inflating oil pricesThe United Arab Emirates has quit the Opec oil cartel after years of membership in a heavy blow to the group and its de facto leader Saudi Arabia as global energy markets contend with the biggest supply crisis in history The shock loss of the UAE Opec s third-largest oil producer is expected to weaken the group which for decades has worked together to use its collective oil production to influence global oil market prices Continue reading'],"['uae', 'quits', 'opec', 'in', 'win', 'for', 'trump', 'as', 'oil', 'cartel', 'weakened', 'us', 'president', 'has', 'accused', 'organisation', 'of', 'ripping', 'off', 'the', 'rest', 'of', 'the', 'world', 'by', 'inflating', 'oil', 'pricesthe', 'united', 'arab', 'emirates', 'has', 'quit', 'the', 'opec', 'oil', 'cartel', 'after', 'years', 'of', 'membership', 'in', 'a', 'heavy', 'blow', 'to', 'the', 'group', 'and', 'its', 'de', 'facto', 'leader', 'saudi', 'arabia', 'as', 'global', 'energy', 'markets', 'contend', 'with', 'the', 'biggest', 'supply', 'crisis', 'in', 'history', 'the', 'shock', 'loss', 'of', 'the', 'uae', 'opec', 's', 'third-largest', 'oil', 'producer', 'is', 'expected', 'to', 'weaken', 'the', 'group', 'which', 'for', 'decades', 'has', 'worked', 'together', 'to', 'use', 'its', 'collective', 'oil', 'production', 'to', 'influence', 'global', 'oil', 'market', 'prices', 'continue', 'reading']","['uae', 'quits', 'opec', 'win', 'trump', 'oil', 'cartel', 'weakened', 'president', 'accused', 'organisation', 'ripping', 'rest', 'world', 'inflating', 'oil', 'pricesthe', 'united', 'arab', 'emirates', 'quit', 'opec', 'oil', 'cartel', 'years', 'membership', 'heavy', 'blow', 'group', 'facto', 'leader', 'saudi', 'arabia', 'global', 'energy', 'markets', 'contend', 'biggest', 'supply', 'crisis', 'history', 'shock', 'loss', 'uae', 'opec', 'oil', 'producer', 'expected', 'weaken', 'group', 'decades', 'worked', 'together', 'use', 'collective', 'oil', 'production', 'influence', 'global', 'oil', 'market', 'prices', 'continue', 'reading']","['uae', 'quits', 'opec', 'win', 'trump', 'oil', 'cartel', 'weakened', 'president', 'accused', 'organisation', 'ripping', 'rest', 'world', 'inflating', 'oil', 'pricesthe', 'united', 'arab', 'emirate', 'quit', 'opec', 'oil', 'cartel', 'year', 'membership', 'heavy', 'blow', 'group', 'facto', 'leader', 'saudi', 'arabia', 'global', 'energy', 'market', 'contend', 'biggest', 'supply', 'crisis', 'history', 'shock', 'loss', 'uae', 'opec', 'oil', 'producer', 'expected', 'weaken', 'group', 'decade', 'worked', 'together', 'use', 'collective', 'oil', 'production', 'influence', 'global', 'oil', 'market', 'price', 'continue', 'reading']","['uae', 'quit', 'opec', 'win', 'trump', 'oil', 'cartel', 'weaken', 'presid', 'accus', 'organis', 'rip', 'rest', 'world', 'inflat', 'oil', 'pricesth', 'unit', 'arab', 'emir', 'quit', 'opec', 'oil', 'cartel', 'year', 'membership', 'heavi', 'blow', 'group', 'facto', 'leader', 'saudi', 'arabia', 'global', 'energi', 'market', 'contend', 'biggest', 'suppli', 'crisi', 'histori', 'shock', 'loss', 'uae', 'opec', 'oil', 'produc', 'expect', 'weaken', 'group', 'decad', 'work', 'togeth', 'use', 'collect', 'oil', 'product', 'influenc', 'global', 'oil', 'market', 'price', 'continu', 'read']","['uae', 'quit', 'opec', 'win', 'trump', 'oil', 'cartel', 'weaken', 'presid', 'accus', 'organis', 'rip', 'rest', 'world', 'inflat', 'oil', 'pricesth', 'unit', 'arab', 'emir', 'quit', 'opec', 'oil', 'cartel', 'year', 'membership', 'heavi', 'blow', 'group', 'facto', 'leader', 'saudi', 'arabia', 'global', 'energi', 'market', 'contend', 'biggest', 'suppli', 'crisi', 'histori', 'shock', 'loss', 'uae', 'opec', 'oil', 'produc', 'expect', 'weaken', 'group', 'decad', 'work', 'togeth', 'use', 'collect', 'oil', 'product', 'influenc', 'global', 'oil', 'market', 'price', 'continu', 'read']"
