source,date,title,summary,text,filtered,normalized,tokens_word,tokens_sentence,tokens_tweet,tokens_clean,lemmas,stems_porter,stems_snowball
The Guardian,2026-04-28,"Russian oligarch’s superyacht allowed through strait of Hormuz, source says","Billionaire Alexei  Mordashov’s vessel, Nord, reportedly able to cross blockaded strait with US and Iranian approvalA superyacht owned by the Russian billionaire Alexei Mordashov was able to transit the blockaded strait of Hormuz after undergoing maintenance in Dubai because neither Iran nor the US objected, a source close to Mordashov said on Tuesday.It has been unclear how the multi-deck pleasure vessel, worth more than $500m (£370m), gained permission to sail on Saturday through the commercially important waterway at the heart of the US-Iran conflict, where traffic has been severely restricted since February. Continue reading...","Russian oligarch’s superyacht allowed through strait of Hormuz, source says Billionaire Alexei  Mordashov’s vessel, Nord, reportedly able to cross blockaded strait with US and Iranian approvalA superyacht owned by the Russian billionaire Alexei Mordashov was able to transit the blockaded strait of Hormuz after undergoing maintenance in Dubai because neither Iran nor the US objected, a source close to Mordashov said on Tuesday.It has been unclear how the multi-deck pleasure vessel, worth more than $500m (£370m), gained permission to sail on Saturday through the commercially important waterway at the heart of the US-Iran conflict, where traffic has been severely restricted since February. Continue reading...",Russian oligarch s superyacht allowed through strait of Hormuz source says Billionaire Alexei Mordashov s vessel Nord reportedly able to cross blockaded strait with US and Iranian approvalA superyacht owned by the Russian billionaire Alexei Mordashov was able to transit the blockaded strait of Hormuz after undergoing maintenance in Dubai because neither Iran nor the US objected a source close to Mordashov said on Tuesday It has been unclear how the multi-deck pleasure vessel worth more than m m gained permission to sail on Saturday through the commercially important waterway at the heart of the US-Iran conflict where traffic has been severely restricted since February Continue reading,russian oligarch s superyacht allowed through strait of hormuz source says billionaire alexei mordashov s vessel nord reportedly able to cross blockaded strait with us and iranian approvala superyacht owned by the russian billionaire alexei mordashov was able to transit the blockaded strait of hormuz after undergoing maintenance in dubai because neither iran nor the us objected a source close to mordashov said on tuesday it has been unclear how the multi-deck pleasure vessel worth more than m m gained permission to sail on saturday through the commercially important waterway at the heart of the us-iran conflict where traffic has been severely restricted since february continue reading,"['russian', 'oligarch', 's', 'superyacht', 'allowed', 'through', 'strait', 'of', 'hormuz', 'source', 'says', 'billionaire', 'alexei', 'mordashov', 's', 'vessel', 'nord', 'reportedly', 'able', 'to', 'cross', 'blockaded', 'strait', 'with', 'us', 'and', 'iranian', 'approvala', 'superyacht', 'owned', 'by', 'the', 'russian', 'billionaire', 'alexei', 'mordashov', 'was', 'able', 'to', 'transit', 'the', 'blockaded', 'strait', 'of', 'hormuz', 'after', 'undergoing', 'maintenance', 'in', 'dubai', 'because', 'neither', 'iran', 'nor', 'the', 'us', 'objected', 'a', 'source', 'close', 'to', 'mordashov', 'said', 'on', 'tuesday', 'it', 'has', 'been', 'unclear', 'how', 'the', 'multi-deck', 'pleasure', 'vessel', 'worth', 'more', 'than', 'm', 'm', 'gained', 'permission', 'to', 'sail', 'on', 'saturday', 'through', 'the', 'commercially', 'important', 'waterway', 'at', 'the', 'heart', 'of', 'the', 'us-iran', 'conflict', 'where', 'traffic', 'has', 'been', 'severely', 'restricted', 'since', 'february', 'continue', 'reading']",['Russian oligarch s superyacht allowed through strait of Hormuz source says Billionaire Alexei Mordashov s vessel Nord reportedly able to cross blockaded strait with US and Iranian approvalA superyacht owned by the Russian billionaire Alexei Mordashov was able to transit the blockaded strait of Hormuz after undergoing maintenance in Dubai because neither Iran nor the US objected a source close to Mordashov said on Tuesday It has been unclear how the multi-deck pleasure vessel worth more than m m gained permission to sail on Saturday through the commercially important waterway at the heart of the US-Iran conflict where traffic has been severely restricted since February Continue reading'],"['russian', 'oligarch', 's', 'superyacht', 'allowed', 'through', 'strait', 'of', 'hormuz', 'source', 'says', 'billionaire', 'alexei', 'mordashov', 's', 'vessel', 'nord', 'reportedly', 'able', 'to', 'cross', 'blockaded', 'strait', 'with', 'us', 'and', 'iranian', 'approvala', 'superyacht', 'owned', 'by', 'the', 'russian', 'billionaire', 'alexei', 'mordashov', 'was', 'able', 'to', 'transit', 'the', 'blockaded', 'strait', 'of', 'hormuz', 'after', 'undergoing', 'maintenance', 'in', 'dubai', 'because', 'neither', 'iran', 'nor', 'the', 'us', 'objected', 'a', 'source', 'close', 'to', 'mordashov', 'said', 'on', 'tuesday', 'it', 'has', 'been', 'unclear', 'how', 'the', 'multi-deck', 'pleasure', 'vessel', 'worth', 'more', 'than', 'm', 'm', 'gained', 'permission', 'to', 'sail', 'on', 'saturday', 'through', 'the', 'commercially', 'important', 'waterway', 'at', 'the', 'heart', 'of', 'the', 'us-iran', 'conflict', 'where', 'traffic', 'has', 'been', 'severely', 'restricted', 'since', 'february', 'continue', 'reading']","['russian', 'oligarch', 'superyacht', 'allowed', 'strait', 'hormuz', 'source', 'says', 'billionaire', 'alexei', 'mordashov', 'vessel', 'nord', 'reportedly', 'able', 'cross', 'blockaded', 'strait', 'iranian', 'approvala', 'superyacht', 'owned', 'russian', 'billionaire', 'alexei', 'mordashov', 'able', 'transit', 'blockaded', 'strait', 'hormuz', 'undergoing', 'maintenance', 'dubai', 'neither', 'iran', 'objected', 'source', 'close', 'mordashov', 'said', 'tuesday', 'unclear', 'pleasure', 'vessel', 'worth', 'gained', 'permission', 'sail', 'saturday', 'commercially', 'important', 'waterway', 'heart', 'conflict', 'traffic', 'severely', 'restricted', 'since', 'february', 'continue', 'reading']","['russian', 'oligarch', 'superyacht', 'allowed', 'strait', 'hormuz', 'source', 'say', 'billionaire', 'alexei', 'mordashov', 'vessel', 'nord', 'reportedly', 'able', 'cross', 'blockaded', 'strait', 'iranian', 'approvala', 'superyacht', 'owned', 'russian', 'billionaire', 'alexei', 'mordashov', 'able', 'transit', 'blockaded', 'strait', 'hormuz', 'undergoing', 'maintenance', 'dubai', 'neither', 'iran', 'objected', 'source', 'close', 'mordashov', 'said', 'tuesday', 'unclear', 'pleasure', 'vessel', 'worth', 'gained', 'permission', 'sail', 'saturday', 'commercially', 'important', 'waterway', 'heart', 'conflict', 'traffic', 'severely', 'restricted', 'since', 'february', 'continue', 'reading']","['russian', 'oligarch', 'superyacht', 'allow', 'strait', 'hormuz', 'sourc', 'say', 'billionair', 'alexei', 'mordashov', 'vessel', 'nord', 'reportedli', 'abl', 'cross', 'blockad', 'strait', 'iranian', 'approvala', 'superyacht', 'own', 'russian', 'billionair', 'alexei', 'mordashov', 'abl', 'transit', 'blockad', 'strait', 'hormuz', 'undergo', 'mainten', 'dubai', 'neither', 'iran', 'object', 'sourc', 'close', 'mordashov', 'said', 'tuesday', 'unclear', 'pleasur', 'vessel', 'worth', 'gain', 'permiss', 'sail', 'saturday', 'commerci', 'import', 'waterway', 'heart', 'conflict', 'traffic', 'sever', 'restrict', 'sinc', 'februari', 'continu', 'read']","['russian', 'oligarch', 'superyacht', 'allow', 'strait', 'hormuz', 'sourc', 'say', 'billionair', 'alexei', 'mordashov', 'vessel', 'nord', 'report', 'abl', 'cross', 'blockad', 'strait', 'iranian', 'approvala', 'superyacht', 'own', 'russian', 'billionair', 'alexei', 'mordashov', 'abl', 'transit', 'blockad', 'strait', 'hormuz', 'undergo', 'mainten', 'dubai', 'neither', 'iran', 'object', 'sourc', 'close', 'mordashov', 'said', 'tuesday', 'unclear', 'pleasur', 'vessel', 'worth', 'gain', 'permiss', 'sail', 'saturday', 'commerci', 'import', 'waterway', 'heart', 'conflict', 'traffic', 'sever', 'restrict', 'sinc', 'februari', 'continu', 'read']"
The Guardian,2026-04-28,Sri Lanka police arrest 22 Buddhist monks after 110kg of cannabis found in luggage,"Customs officials say group allegedly hid 5kg of ‘kush’ in false walls of bags on return from Bangkok holidayTwenty-two Buddhist monks are in Sri Lankan police custody after customs officials found 110kg of high-grade cannabis concealed in their luggage, the largest ever drug bust at Colombo’s main international airport.The group, mostly junior monks in training from temples across Sri Lanka, were alleged to have “carried about five kilos of the narcotic concealed within false walls in their luggage”, according to a Sri Lanka customs spokesperson. Continue reading...","Sri Lanka police arrest 22 Buddhist monks after 110kg of cannabis found in luggage Customs officials say group allegedly hid 5kg of ‘kush’ in false walls of bags on return from Bangkok holidayTwenty-two Buddhist monks are in Sri Lankan police custody after customs officials found 110kg of high-grade cannabis concealed in their luggage, the largest ever drug bust at Colombo’s main international airport.The group, mostly junior monks in training from temples across Sri Lanka, were alleged to have “carried about five kilos of the narcotic concealed within false walls in their luggage”, according to a Sri Lanka customs spokesperson. Continue reading...",Sri Lanka police arrest Buddhist monks after kg of cannabis found in luggage Customs officials say group allegedly hid kg of kush in false walls of bags on return from Bangkok holidayTwenty-two Buddhist monks are in Sri Lankan police custody after customs officials found kg of high-grade cannabis concealed in their luggage the largest ever drug bust at Colombo s main international airport The group mostly junior monks in training from temples across Sri Lanka were alleged to have carried about five kilos of the narcotic concealed within false walls in their luggage according to a Sri Lanka customs spokesperson Continue reading,sri lanka police arrest buddhist monks after kg of cannabis found in luggage customs officials say group allegedly hid kg of kush in false walls of bags on return from bangkok holidaytwenty-two buddhist monks are in sri lankan police custody after customs officials found kg of high-grade cannabis concealed in their luggage the largest ever drug bust at colombo s main international airport the group mostly junior monks in training from temples across sri lanka were alleged to have carried about five kilos of the narcotic concealed within false walls in their luggage according to a sri lanka customs spokesperson continue reading,"['sri', 'lanka', 'police', 'arrest', 'buddhist', 'monks', 'after', 'kg', 'of', 'cannabis', 'found', 'in', 'luggage', 'customs', 'officials', 'say', 'group', 'allegedly', 'hid', 'kg', 'of', 'kush', 'in', 'false', 'walls', 'of', 'bags', 'on', 'return', 'from', 'bangkok', 'holidaytwenty-two', 'buddhist', 'monks', 'are', 'in', 'sri', 'lankan', 'police', 'custody', 'after', 'customs', 'officials', 'found', 'kg', 'of', 'high-grade', 'cannabis', 'concealed', 'in', 'their', 'luggage', 'the', 'largest', 'ever', 'drug', 'bust', 'at', 'colombo', 's', 'main', 'international', 'airport', 'the', 'group', 'mostly', 'junior', 'monks', 'in', 'training', 'from', 'temples', 'across', 'sri', 'lanka', 'were', 'alleged', 'to', 'have', 'carried', 'about', 'five', 'kilos', 'of', 'the', 'narcotic', 'concealed', 'within', 'false', 'walls', 'in', 'their', 'luggage', 'according', 'to', 'a', 'sri', 'lanka', 'customs', 'spokesperson', 'continue', 'reading']",['Sri Lanka police arrest Buddhist monks after kg of cannabis found in luggage Customs officials say group allegedly hid kg of kush in false walls of bags on return from Bangkok holidayTwenty-two Buddhist monks are in Sri Lankan police custody after customs officials found kg of high-grade cannabis concealed in their luggage the largest ever drug bust at Colombo s main international airport The group mostly junior monks in training from temples across Sri Lanka were alleged to have carried about five kilos of the narcotic concealed within false walls in their luggage according to a Sri Lanka customs spokesperson Continue reading'],"['sri', 'lanka', 'police', 'arrest', 'buddhist', 'monks', 'after', 'kg', 'of', 'cannabis', 'found', 'in', 'luggage', 'customs', 'officials', 'say', 'group', 'allegedly', 'hid', 'kg', 'of', 'kush', 'in', 'false', 'walls', 'of', 'bags', 'on', 'return', 'from', 'bangkok', 'holidaytwenty-two', 'buddhist', 'monks', 'are', 'in', 'sri', 'lankan', 'police', 'custody', 'after', 'customs', 'officials', 'found', 'kg', 'of', 'high-grade', 'cannabis', 'concealed', 'in', 'their', 'luggage', 'the', 'largest', 'ever', 'drug', 'bust', 'at', 'colombo', 's', 'main', 'international', 'airport', 'the', 'group', 'mostly', 'junior', 'monks', 'in', 'training', 'from', 'temples', 'across', 'sri', 'lanka', 'were', 'alleged', 'to', 'have', 'carried', 'about', 'five', 'kilos', 'of', 'the', 'narcotic', 'concealed', 'within', 'false', 'walls', 'in', 'their', 'luggage', 'according', 'to', 'a', 'sri', 'lanka', 'customs', 'spokesperson', 'continue', 'reading']","['sri', 'lanka', 'police', 'arrest', 'buddhist', 'monks', 'cannabis', 'found', 'luggage', 'customs', 'officials', 'say', 'group', 'allegedly', 'hid', 'kush', 'false', 'walls', 'bags', 'return', 'bangkok', 'buddhist', 'monks', 'sri', 'lankan', 'police', 'custody', 'customs', 'officials', 'found', 'cannabis', 'concealed', 'luggage', 'largest', 'ever', 'drug', 'bust', 'colombo', 'main', 'international', 'airport', 'group', 'mostly', 'junior', 'monks', 'training', 'temples', 'across', 'sri', 'lanka', 'alleged', 'carried', 'five', 'kilos', 'narcotic', 'concealed', 'within', 'false', 'walls', 'luggage', 'according', 'sri', 'lanka', 'customs', 'spokesperson', 'continue', 'reading']","['sri', 'lanka', 'police', 'arrest', 'buddhist', 'monk', 'cannabis', 'found', 'luggage', 'custom', 'official', 'say', 'group', 'allegedly', 'hid', 'kush', 'false', 'wall', 'bag', 'return', 'bangkok', 'buddhist', 'monk', 'sri', 'lankan', 'police', 'custody', 'custom', 'official', 'found', 'cannabis', 'concealed', 'luggage', 'largest', 'ever', 'drug', 'bust', 'colombo', 'main', 'international', 'airport', 'group', 'mostly', 'junior', 'monk', 'training', 'temple', 'across', 'sri', 'lanka', 'alleged', 'carried', 'five', 'kilo', 'narcotic', 'concealed', 'within', 'false', 'wall', 'luggage', 'according', 'sri', 'lanka', 'custom', 'spokesperson', 'continue', 'reading']","['sri', 'lanka', 'polic', 'arrest', 'buddhist', 'monk', 'cannabi', 'found', 'luggag', 'custom', 'offici', 'say', 'group', 'allegedli', 'hid', 'kush', 'fals', 'wall', 'bag', 'return', 'bangkok', 'buddhist', 'monk', 'sri', 'lankan', 'polic', 'custodi', 'custom', 'offici', 'found', 'cannabi', 'conceal', 'luggag', 'largest', 'ever', 'drug', 'bust', 'colombo', 'main', 'intern', 'airport', 'group', 'mostli', 'junior', 'monk', 'train', 'templ', 'across', 'sri', 'lanka', 'alleg', 'carri', 'five', 'kilo', 'narcot', 'conceal', 'within', 'fals', 'wall', 'luggag', 'accord', 'sri', 'lanka', 'custom', 'spokesperson', 'continu', 'read']","['sri', 'lanka', 'polic', 'arrest', 'buddhist', 'monk', 'cannabi', 'found', 'luggag', 'custom', 'offici', 'say', 'group', 'alleg', 'hid', 'kush', 'fals', 'wall', 'bag', 'return', 'bangkok', 'buddhist', 'monk', 'sri', 'lankan', 'polic', 'custodi', 'custom', 'offici', 'found', 'cannabi', 'conceal', 'luggag', 'largest', 'ever', 'drug', 'bust', 'colombo', 'main', 'intern', 'airport', 'group', 'most', 'junior', 'monk', 'train', 'templ', 'across', 'sri', 'lanka', 'alleg', 'carri', 'five', 'kilo', 'narcot', 'conceal', 'within', 'fals', 'wall', 'luggag', 'accord', 'sri', 'lanka', 'custom', 'spokesperson', 'continu', 'read']"
The Guardian,2026-04-27,Afghanistan says Pakistani strikes kill seven and wound 85 in first attack since peace talks,"Pakistan officials dismiss Afghan media reports and official statements about strikes on university in Kunar province as ‘blatant lie’Mortars and missiles fired from Pakistan on Monday struck a university and civilian homes in north-eastern Afghanistan, killing seven people and wounding at least 85, Afghan officials said.Pakistan denied the accusation of targeting a university. Continue reading...","Afghanistan says Pakistani strikes kill seven and wound 85 in first attack since peace talks Pakistan officials dismiss Afghan media reports and official statements about strikes on university in Kunar province as ‘blatant lie’Mortars and missiles fired from Pakistan on Monday struck a university and civilian homes in north-eastern Afghanistan, killing seven people and wounding at least 85, Afghan officials said.Pakistan denied the accusation of targeting a university. Continue reading...",Afghanistan says Pakistani strikes kill seven and wound in first attack since peace talks Pakistan officials dismiss Afghan media reports and official statements about strikes on university in Kunar province as blatant lie Mortars and missiles fired from Pakistan on Monday struck a university and civilian homes in north-eastern Afghanistan killing seven people and wounding at least Afghan officials said Pakistan denied the accusation of targeting a university Continue reading,afghanistan says pakistani strikes kill seven and wound in first attack since peace talks pakistan officials dismiss afghan media reports and official statements about strikes on university in kunar province as blatant lie mortars and missiles fired from pakistan on monday struck a university and civilian homes in north-eastern afghanistan killing seven people and wounding at least afghan officials said pakistan denied the accusation of targeting a university continue reading,"['afghanistan', 'says', 'pakistani', 'strikes', 'kill', 'seven', 'and', 'wound', 'in', 'first', 'attack', 'since', 'peace', 'talks', 'pakistan', 'officials', 'dismiss', 'afghan', 'media', 'reports', 'and', 'official', 'statements', 'about', 'strikes', 'on', 'university', 'in', 'kunar', 'province', 'as', 'blatant', 'lie', 'mortars', 'and', 'missiles', 'fired', 'from', 'pakistan', 'on', 'monday', 'struck', 'a', 'university', 'and', 'civilian', 'homes', 'in', 'north-eastern', 'afghanistan', 'killing', 'seven', 'people', 'and', 'wounding', 'at', 'least', 'afghan', 'officials', 'said', 'pakistan', 'denied', 'the', 'accusation', 'of', 'targeting', 'a', 'university', 'continue', 'reading']",['Afghanistan says Pakistani strikes kill seven and wound in first attack since peace talks Pakistan officials dismiss Afghan media reports and official statements about strikes on university in Kunar province as blatant lie Mortars and missiles fired from Pakistan on Monday struck a university and civilian homes in north-eastern Afghanistan killing seven people and wounding at least Afghan officials said Pakistan denied the accusation of targeting a university Continue reading'],"['afghanistan', 'says', 'pakistani', 'strikes', 'kill', 'seven', 'and', 'wound', 'in', 'first', 'attack', 'since', 'peace', 'talks', 'pakistan', 'officials', 'dismiss', 'afghan', 'media', 'reports', 'and', 'official', 'statements', 'about', 'strikes', 'on', 'university', 'in', 'kunar', 'province', 'as', 'blatant', 'lie', 'mortars', 'and', 'missiles', 'fired', 'from', 'pakistan', 'on', 'monday', 'struck', 'a', 'university', 'and', 'civilian', 'homes', 'in', 'north-eastern', 'afghanistan', 'killing', 'seven', 'people', 'and', 'wounding', 'at', 'least', 'afghan', 'officials', 'said', 'pakistan', 'denied', 'the', 'accusation', 'of', 'targeting', 'a', 'university', 'continue', 'reading']","['afghanistan', 'says', 'pakistani', 'strikes', 'kill', 'seven', 'wound', 'first', 'attack', 'since', 'peace', 'talks', 'pakistan', 'officials', 'dismiss', 'afghan', 'media', 'reports', 'official', 'statements', 'strikes', 'university', 'kunar', 'province', 'blatant', 'lie', 'mortars', 'missiles', 'fired', 'pakistan', 'monday', 'struck', 'university', 'civilian', 'homes', 'afghanistan', 'killing', 'seven', 'people', 'wounding', 'least', 'afghan', 'officials', 'said', 'pakistan', 'denied', 'accusation', 'targeting', 'university', 'continue', 'reading']","['afghanistan', 'say', 'pakistani', 'strike', 'kill', 'seven', 'wound', 'first', 'attack', 'since', 'peace', 'talk', 'pakistan', 'official', 'dismiss', 'afghan', 'medium', 'report', 'official', 'statement', 'strike', 'university', 'kunar', 'province', 'blatant', 'lie', 'mortar', 'missile', 'fired', 'pakistan', 'monday', 'struck', 'university', 'civilian', 'home', 'afghanistan', 'killing', 'seven', 'people', 'wounding', 'least', 'afghan', 'official', 'said', 'pakistan', 'denied', 'accusation', 'targeting', 'university', 'continue', 'reading']","['afghanistan', 'say', 'pakistani', 'strike', 'kill', 'seven', 'wound', 'first', 'attack', 'sinc', 'peac', 'talk', 'pakistan', 'offici', 'dismiss', 'afghan', 'media', 'report', 'offici', 'statement', 'strike', 'univers', 'kunar', 'provinc', 'blatant', 'lie', 'mortar', 'missil', 'fire', 'pakistan', 'monday', 'struck', 'univers', 'civilian', 'home', 'afghanistan', 'kill', 'seven', 'peopl', 'wound', 'least', 'afghan', 'offici', 'said', 'pakistan', 'deni', 'accus', 'target', 'univers', 'continu', 'read']","['afghanistan', 'say', 'pakistani', 'strike', 'kill', 'seven', 'wound', 'first', 'attack', 'sinc', 'peac', 'talk', 'pakistan', 'offici', 'dismiss', 'afghan', 'media', 'report', 'offici', 'statement', 'strike', 'univers', 'kunar', 'provinc', 'blatant', 'lie', 'mortar', 'missil', 'fire', 'pakistan', 'monday', 'struck', 'univers', 'civilian', 'home', 'afghanistan', 'kill', 'seven', 'peopl', 'wound', 'least', 'afghan', 'offici', 'said', 'pakistan', 'deni', 'accus', 'target', 'univers', 'continu', 'read']"
