source,date,title,summary,text,filtered,normalized,tokens_word,tokens_sentence,tokens_tweet,tokens_clean,lemmas,stems_porter,stems_snowball
New York Times,2026-04-28,Man Pleads Guilty to Planning Attack at Taylor Swift Concert in Vienna,"Austrian prosecutors said the man plotted in 2024 to set off a bomb outside the concert, which was later canceled. He and another man still face separate charges.","Man Pleads Guilty to Planning Attack at Taylor Swift Concert in Vienna Austrian prosecutors said the man plotted in 2024 to set off a bomb outside the concert, which was later canceled. He and another man still face separate charges.",Man Pleads Guilty to Planning Attack at Taylor Swift Concert in Vienna Austrian prosecutors said the man plotted in to set off a bomb outside the concert which was later canceled He and another man still face separate charges,man pleads guilty to planning attack at taylor swift concert in vienna austrian prosecutors said the man plotted in to set off a bomb outside the concert which was later canceled he and another man still face separate charges,"['man', 'pleads', 'guilty', 'to', 'planning', 'attack', 'at', 'taylor', 'swift', 'concert', 'in', 'vienna', 'austrian', 'prosecutors', 'said', 'the', 'man', 'plotted', 'in', 'to', 'set', 'off', 'a', 'bomb', 'outside', 'the', 'concert', 'which', 'was', 'later', 'canceled', 'he', 'and', 'another', 'man', 'still', 'face', 'separate', 'charges']",['Man Pleads Guilty to Planning Attack at Taylor Swift Concert in Vienna Austrian prosecutors said the man plotted in to set off a bomb outside the concert which was later canceled He and another man still face separate charges'],"['man', 'pleads', 'guilty', 'to', 'planning', 'attack', 'at', 'taylor', 'swift', 'concert', 'in', 'vienna', 'austrian', 'prosecutors', 'said', 'the', 'man', 'plotted', 'in', 'to', 'set', 'off', 'a', 'bomb', 'outside', 'the', 'concert', 'which', 'was', 'later', 'canceled', 'he', 'and', 'another', 'man', 'still', 'face', 'separate', 'charges']","['man', 'pleads', 'guilty', 'planning', 'attack', 'taylor', 'swift', 'concert', 'vienna', 'austrian', 'prosecutors', 'said', 'man', 'plotted', 'set', 'bomb', 'outside', 'concert', 'later', 'canceled', 'another', 'man', 'still', 'face', 'separate', 'charges']","['man', 'pleads', 'guilty', 'planning', 'attack', 'taylor', 'swift', 'concert', 'vienna', 'austrian', 'prosecutor', 'said', 'man', 'plotted', 'set', 'bomb', 'outside', 'concert', 'later', 'canceled', 'another', 'man', 'still', 'face', 'separate', 'charge']","['man', 'plead', 'guilti', 'plan', 'attack', 'taylor', 'swift', 'concert', 'vienna', 'austrian', 'prosecutor', 'said', 'man', 'plot', 'set', 'bomb', 'outsid', 'concert', 'later', 'cancel', 'anoth', 'man', 'still', 'face', 'separ', 'charg']","['man', 'plead', 'guilti', 'plan', 'attack', 'taylor', 'swift', 'concert', 'vienna', 'austrian', 'prosecutor', 'said', 'man', 'plot', 'set', 'bomb', 'outsid', 'concert', 'later', 'cancel', 'anoth', 'man', 'still', 'face', 'separ', 'charg']"
New York Times,2026-04-28,First Fully Loaded L.N.G. Tanker Since War Began Appears to Have Crossed the Strait,"Liquefied natural gas transit has been effectively halted. A ship managed by Abu Dhabi’s state oil company managed to cross, said Kpler, a maritime data firm.","First Fully Loaded L.N.G. Tanker Since War Began Appears to Have Crossed the Strait Liquefied natural gas transit has been effectively halted. A ship managed by Abu Dhabi’s state oil company managed to cross, said Kpler, a maritime data firm.",First Fully Loaded L N G Tanker Since War Began Appears to Have Crossed the Strait Liquefied natural gas transit has been effectively halted A ship managed by Abu Dhabi s state oil company managed to cross said Kpler a maritime data firm,first fully loaded l n g tanker since war began appears to have crossed the strait liquefied natural gas transit has been effectively halted a ship managed by abu dhabi s state oil company managed to cross said kpler a maritime data firm,"['first', 'fully', 'loaded', 'l', 'n', 'g', 'tanker', 'since', 'war', 'began', 'appears', 'to', 'have', 'crossed', 'the', 'strait', 'liquefied', 'natural', 'gas', 'transit', 'has', 'been', 'effectively', 'halted', 'a', 'ship', 'managed', 'by', 'abu', 'dhabi', 's', 'state', 'oil', 'company', 'managed', 'to', 'cross', 'said', 'kpler', 'a', 'maritime', 'data', 'firm']",['First Fully Loaded L N G Tanker Since War Began Appears to Have Crossed the Strait Liquefied natural gas transit has been effectively halted A ship managed by Abu Dhabi s state oil company managed to cross said Kpler a maritime data firm'],"['first', 'fully', 'loaded', 'l', 'n', 'g', 'tanker', 'since', 'war', 'began', 'appears', 'to', 'have', 'crossed', 'the', 'strait', 'liquefied', 'natural', 'gas', 'transit', 'has', 'been', 'effectively', 'halted', 'a', 'ship', 'managed', 'by', 'abu', 'dhabi', 's', 'state', 'oil', 'company', 'managed', 'to', 'cross', 'said', 'kpler', 'a', 'maritime', 'data', 'firm']","['first', 'fully', 'loaded', 'tanker', 'since', 'war', 'began', 'appears', 'crossed', 'strait', 'liquefied', 'natural', 'gas', 'transit', 'effectively', 'halted', 'ship', 'managed', 'abu', 'dhabi', 'state', 'oil', 'company', 'managed', 'cross', 'said', 'kpler', 'maritime', 'data', 'firm']","['first', 'fully', 'loaded', 'tanker', 'since', 'war', 'began', 'appears', 'crossed', 'strait', 'liquefied', 'natural', 'gas', 'transit', 'effectively', 'halted', 'ship', 'managed', 'abu', 'dhabi', 'state', 'oil', 'company', 'managed', 'cross', 'said', 'kpler', 'maritime', 'data', 'firm']","['first', 'fulli', 'load', 'tanker', 'sinc', 'war', 'began', 'appear', 'cross', 'strait', 'liquefi', 'natur', 'ga', 'transit', 'effect', 'halt', 'ship', 'manag', 'abu', 'dhabi', 'state', 'oil', 'compani', 'manag', 'cross', 'said', 'kpler', 'maritim', 'data', 'firm']","['first', 'fulli', 'load', 'tanker', 'sinc', 'war', 'began', 'appear', 'cross', 'strait', 'liquefi', 'natur', 'gas', 'transit', 'effect', 'halt', 'ship', 'manag', 'abu', 'dhabi', 'state', 'oil', 'compani', 'manag', 'cross', 'said', 'kpler', 'maritim', 'data', 'firm']"
New York Times,2026-04-28,Fuel Crisis Creates Commuter Crush in the Philippines,"Rising fuel prices in the Philippines have disrupted daily commutes, forcing people to ditch their cars for overcrowded trains and minibuses.","Fuel Crisis Creates Commuter Crush in the Philippines Rising fuel prices in the Philippines have disrupted daily commutes, forcing people to ditch their cars for overcrowded trains and minibuses.",Fuel Crisis Creates Commuter Crush in the Philippines Rising fuel prices in the Philippines have disrupted daily commutes forcing people to ditch their cars for overcrowded trains and minibuses,fuel crisis creates commuter crush in the philippines rising fuel prices in the philippines have disrupted daily commutes forcing people to ditch their cars for overcrowded trains and minibuses,"['fuel', 'crisis', 'creates', 'commuter', 'crush', 'in', 'the', 'philippines', 'rising', 'fuel', 'prices', 'in', 'the', 'philippines', 'have', 'disrupted', 'daily', 'commutes', 'forcing', 'people', 'to', 'ditch', 'their', 'cars', 'for', 'overcrowded', 'trains', 'and', 'minibuses']",['Fuel Crisis Creates Commuter Crush in the Philippines Rising fuel prices in the Philippines have disrupted daily commutes forcing people to ditch their cars for overcrowded trains and minibuses'],"['fuel', 'crisis', 'creates', 'commuter', 'crush', 'in', 'the', 'philippines', 'rising', 'fuel', 'prices', 'in', 'the', 'philippines', 'have', 'disrupted', 'daily', 'commutes', 'forcing', 'people', 'to', 'ditch', 'their', 'cars', 'for', 'overcrowded', 'trains', 'and', 'minibuses']","['fuel', 'crisis', 'creates', 'commuter', 'crush', 'philippines', 'rising', 'fuel', 'prices', 'philippines', 'disrupted', 'daily', 'commutes', 'forcing', 'people', 'ditch', 'cars', 'overcrowded', 'trains', 'minibuses']","['fuel', 'crisis', 'creates', 'commuter', 'crush', 'philippine', 'rising', 'fuel', 'price', 'philippine', 'disrupted', 'daily', 'commute', 'forcing', 'people', 'ditch', 'car', 'overcrowded', 'train', 'minibus']","['fuel', 'crisi', 'creat', 'commut', 'crush', 'philippin', 'rise', 'fuel', 'price', 'philippin', 'disrupt', 'daili', 'commut', 'forc', 'peopl', 'ditch', 'car', 'overcrowd', 'train', 'minibus']","['fuel', 'crisi', 'creat', 'commut', 'crush', 'philippin', 'rise', 'fuel', 'price', 'philippin', 'disrupt', 'daili', 'commut', 'forc', 'peopl', 'ditch', 'car', 'overcrowd', 'train', 'minibus']"
New York Times,2026-04-29,Ron Paul Saw The U.S. Mint’s Gold Problems Coming,And he’s basically fine with it.,Ron Paul Saw The U.S. Mint’s Gold Problems Coming And he’s basically fine with it.,Ron Paul Saw The U S Mint s Gold Problems Coming And he s basically fine with it,ron paul saw the u s mint s gold problems coming and he s basically fine with it,"['ron', 'paul', 'saw', 'the', 'u', 's', 'mint', 's', 'gold', 'problems', 'coming', 'and', 'he', 's', 'basically', 'fine', 'with', 'it']",['Ron Paul Saw The U S Mint s Gold Problems Coming And he s basically fine with it'],"['ron', 'paul', 'saw', 'the', 'u', 's', 'mint', 's', 'gold', 'problems', 'coming', 'and', 'he', 's', 'basically', 'fine', 'with', 'it']","['ron', 'paul', 'saw', 'mint', 'gold', 'problems', 'coming', 'basically', 'fine']","['ron', 'paul', 'saw', 'mint', 'gold', 'problem', 'coming', 'basically', 'fine']","['ron', 'paul', 'saw', 'mint', 'gold', 'problem', 'come', 'basic', 'fine']","['ron', 'paul', 'saw', 'mint', 'gold', 'problem', 'come', 'basic', 'fine']"
New York Times,2026-04-28,"Trains Collide in Indonesia, Killing at Least 14 and Injuring Dozens",Rescue teams searched for survivors overnight after two trains collided near Jakarta on Monday. The authorities said at least 84 people were injured.,"Trains Collide in Indonesia, Killing at Least 14 and Injuring Dozens Rescue teams searched for survivors overnight after two trains collided near Jakarta on Monday. The authorities said at least 84 people were injured.",Trains Collide in Indonesia Killing at Least and Injuring Dozens Rescue teams searched for survivors overnight after two trains collided near Jakarta on Monday The authorities said at least people were injured,trains collide in indonesia killing at least and injuring dozens rescue teams searched for survivors overnight after two trains collided near jakarta on monday the authorities said at least people were injured,"['trains', 'collide', 'in', 'indonesia', 'killing', 'at', 'least', 'and', 'injuring', 'dozens', 'rescue', 'teams', 'searched', 'for', 'survivors', 'overnight', 'after', 'two', 'trains', 'collided', 'near', 'jakarta', 'on', 'monday', 'the', 'authorities', 'said', 'at', 'least', 'people', 'were', 'injured']",['Trains Collide in Indonesia Killing at Least and Injuring Dozens Rescue teams searched for survivors overnight after two trains collided near Jakarta on Monday The authorities said at least people were injured'],"['trains', 'collide', 'in', 'indonesia', 'killing', 'at', 'least', 'and', 'injuring', 'dozens', 'rescue', 'teams', 'searched', 'for', 'survivors', 'overnight', 'after', 'two', 'trains', 'collided', 'near', 'jakarta', 'on', 'monday', 'the', 'authorities', 'said', 'at', 'least', 'people', 'were', 'injured']","['trains', 'collide', 'indonesia', 'killing', 'least', 'injuring', 'dozens', 'rescue', 'teams', 'searched', 'survivors', 'overnight', 'two', 'trains', 'collided', 'near', 'jakarta', 'monday', 'authorities', 'said', 'least', 'people', 'injured']","['train', 'collide', 'indonesia', 'killing', 'least', 'injuring', 'dozen', 'rescue', 'team', 'searched', 'survivor', 'overnight', 'two', 'train', 'collided', 'near', 'jakarta', 'monday', 'authority', 'said', 'least', 'people', 'injured']","['train', 'collid', 'indonesia', 'kill', 'least', 'injur', 'dozen', 'rescu', 'team', 'search', 'survivor', 'overnight', 'two', 'train', 'collid', 'near', 'jakarta', 'monday', 'author', 'said', 'least', 'peopl', 'injur']","['train', 'collid', 'indonesia', 'kill', 'least', 'injur', 'dozen', 'rescu', 'team', 'search', 'survivor', 'overnight', 'two', 'train', 'collid', 'near', 'jakarta', 'monday', 'author', 'said', 'least', 'peopl', 'injur']"
New York Times,2026-04-28,How South Korea Uses A.I. to Check on Its Elderly,"In the world’s fastest aging society, artificial intelligence is being used to make care calls to older adults who live alone and to fight dementia.","How South Korea Uses A.I. to Check on Its Elderly In the world’s fastest aging society, artificial intelligence is being used to make care calls to older adults who live alone and to fight dementia.",How South Korea Uses A I to Check on Its Elderly In the world s fastest aging society artificial intelligence is being used to make care calls to older adults who live alone and to fight dementia,how south korea uses a i to check on its elderly in the world s fastest aging society artificial intelligence is being used to make care calls to older adults who live alone and to fight dementia,"['how', 'south', 'korea', 'uses', 'a', 'i', 'to', 'check', 'on', 'its', 'elderly', 'in', 'the', 'world', 's', 'fastest', 'aging', 'society', 'artificial', 'intelligence', 'is', 'being', 'used', 'to', 'make', 'care', 'calls', 'to', 'older', 'adults', 'who', 'live', 'alone', 'and', 'to', 'fight', 'dementia']",['How South Korea Uses A I to Check on Its Elderly In the world s fastest aging society artificial intelligence is being used to make care calls to older adults who live alone and to fight dementia'],"['how', 'south', 'korea', 'uses', 'a', 'i', 'to', 'check', 'on', 'its', 'elderly', 'in', 'the', 'world', 's', 'fastest', 'aging', 'society', 'artificial', 'intelligence', 'is', 'being', 'used', 'to', 'make', 'care', 'calls', 'to', 'older', 'adults', 'who', 'live', 'alone', 'and', 'to', 'fight', 'dementia']","['south', 'korea', 'uses', 'check', 'elderly', 'world', 'fastest', 'aging', 'society', 'artificial', 'intelligence', 'used', 'make', 'care', 'calls', 'older', 'adults', 'live', 'alone', 'fight', 'dementia']","['south', 'korea', 'us', 'check', 'elderly', 'world', 'fastest', 'aging', 'society', 'artificial', 'intelligence', 'used', 'make', 'care', 'call', 'older', 'adult', 'live', 'alone', 'fight', 'dementia']","['south', 'korea', 'use', 'check', 'elderli', 'world', 'fastest', 'age', 'societi', 'artifici', 'intellig', 'use', 'make', 'care', 'call', 'older', 'adult', 'live', 'alon', 'fight', 'dementia']","['south', 'korea', 'use', 'check', 'elder', 'world', 'fastest', 'age', 'societi', 'artifici', 'intellig', 'use', 'make', 'care', 'call', 'older', 'adult', 'live', 'alon', 'fight', 'dementia']"
New York Times,2026-04-28,"In Iran, Cheetah Sightings Offer Rare Spots of Hope Amid War","Conservationists say they have recorded several new adult and cub Asiatic cheetahs, a critically endangered subspecies found only in Iran.","In Iran, Cheetah Sightings Offer Rare Spots of Hope Amid War Conservationists say they have recorded several new adult and cub Asiatic cheetahs, a critically endangered subspecies found only in Iran.",In Iran Cheetah Sightings Offer Rare Spots of Hope Amid War Conservationists say they have recorded several new adult and cub Asiatic cheetahs a critically endangered subspecies found only in Iran,in iran cheetah sightings offer rare spots of hope amid war conservationists say they have recorded several new adult and cub asiatic cheetahs a critically endangered subspecies found only in iran,"['in', 'iran', 'cheetah', 'sightings', 'offer', 'rare', 'spots', 'of', 'hope', 'amid', 'war', 'conservationists', 'say', 'they', 'have', 'recorded', 'several', 'new', 'adult', 'and', 'cub', 'asiatic', 'cheetahs', 'a', 'critically', 'endangered', 'subspecies', 'found', 'only', 'in', 'iran']",['In Iran Cheetah Sightings Offer Rare Spots of Hope Amid War Conservationists say they have recorded several new adult and cub Asiatic cheetahs a critically endangered subspecies found only in Iran'],"['in', 'iran', 'cheetah', 'sightings', 'offer', 'rare', 'spots', 'of', 'hope', 'amid', 'war', 'conservationists', 'say', 'they', 'have', 'recorded', 'several', 'new', 'adult', 'and', 'cub', 'asiatic', 'cheetahs', 'a', 'critically', 'endangered', 'subspecies', 'found', 'only', 'in', 'iran']","['iran', 'cheetah', 'sightings', 'offer', 'rare', 'spots', 'hope', 'amid', 'war', 'conservationists', 'say', 'recorded', 'several', 'new', 'adult', 'cub', 'asiatic', 'cheetahs', 'critically', 'endangered', 'subspecies', 'found', 'iran']","['iran', 'cheetah', 'sighting', 'offer', 'rare', 'spot', 'hope', 'amid', 'war', 'conservationist', 'say', 'recorded', 'several', 'new', 'adult', 'cub', 'asiatic', 'cheetah', 'critically', 'endangered', 'subspecies', 'found', 'iran']","['iran', 'cheetah', 'sight', 'offer', 'rare', 'spot', 'hope', 'amid', 'war', 'conservationist', 'say', 'record', 'sever', 'new', 'adult', 'cub', 'asiat', 'cheetah', 'critic', 'endang', 'subspeci', 'found', 'iran']","['iran', 'cheetah', 'sight', 'offer', 'rare', 'spot', 'hope', 'amid', 'war', 'conservationist', 'say', 'record', 'sever', 'new', 'adult', 'cub', 'asiat', 'cheetah', 'critic', 'endang', 'subspeci', 'found', 'iran']"
New York Times,2026-04-27,"Iraq Taps Businessman, Ali al-Zaidi, to Form New Government","After months of tensions and pressure from both the U.S. and Iran, Ali al-Zaidi, a businessman, was named as prime minister-designate.","Iraq Taps Businessman, Ali al-Zaidi, to Form New Government After months of tensions and pressure from both the U.S. and Iran, Ali al-Zaidi, a businessman, was named as prime minister-designate.",Iraq Taps Businessman Ali al-Zaidi to Form New Government After months of tensions and pressure from both the U S and Iran Ali al-Zaidi a businessman was named as prime minister-designate,iraq taps businessman ali al-zaidi to form new government after months of tensions and pressure from both the u s and iran ali al-zaidi a businessman was named as prime minister-designate,"['iraq', 'taps', 'businessman', 'ali', 'al-zaidi', 'to', 'form', 'new', 'government', 'after', 'months', 'of', 'tensions', 'and', 'pressure', 'from', 'both', 'the', 'u', 's', 'and', 'iran', 'ali', 'al-zaidi', 'a', 'businessman', 'was', 'named', 'as', 'prime', 'minister-designate']",['Iraq Taps Businessman Ali al-Zaidi to Form New Government After months of tensions and pressure from both the U S and Iran Ali al-Zaidi a businessman was named as prime minister-designate'],"['iraq', 'taps', 'businessman', 'ali', 'al-zaidi', 'to', 'form', 'new', 'government', 'after', 'months', 'of', 'tensions', 'and', 'pressure', 'from', 'both', 'the', 'u', 's', 'and', 'iran', 'ali', 'al-zaidi', 'a', 'businessman', 'was', 'named', 'as', 'prime', 'minister-designate']","['iraq', 'taps', 'businessman', 'ali', 'form', 'new', 'government', 'months', 'tensions', 'pressure', 'iran', 'ali', 'businessman', 'named', 'prime']","['iraq', 'tap', 'businessman', 'ali', 'form', 'new', 'government', 'month', 'tension', 'pressure', 'iran', 'ali', 'businessman', 'named', 'prime']","['iraq', 'tap', 'businessman', 'ali', 'form', 'new', 'govern', 'month', 'tension', 'pressur', 'iran', 'ali', 'businessman', 'name', 'prime']","['iraq', 'tap', 'businessman', 'ali', 'form', 'new', 'govern', 'month', 'tension', 'pressur', 'iran', 'ali', 'businessman', 'name', 'prime']"
New York Times,2026-04-27,Mali Rebels Strike Major Blow Against Junta and Russia’s Africa Corps,Coordinated attacks signified a major escalation of insurgent violence in a region of West Africa where military leaders had seized power and warmed to Moscow in recent years.,Mali Rebels Strike Major Blow Against Junta and Russia’s Africa Corps Coordinated attacks signified a major escalation of insurgent violence in a region of West Africa where military leaders had seized power and warmed to Moscow in recent years.,Mali Rebels Strike Major Blow Against Junta and Russia s Africa Corps Coordinated attacks signified a major escalation of insurgent violence in a region of West Africa where military leaders had seized power and warmed to Moscow in recent years,mali rebels strike major blow against junta and russia s africa corps coordinated attacks signified a major escalation of insurgent violence in a region of west africa where military leaders had seized power and warmed to moscow in recent years,"['mali', 'rebels', 'strike', 'major', 'blow', 'against', 'junta', 'and', 'russia', 's', 'africa', 'corps', 'coordinated', 'attacks', 'signified', 'a', 'major', 'escalation', 'of', 'insurgent', 'violence', 'in', 'a', 'region', 'of', 'west', 'africa', 'where', 'military', 'leaders', 'had', 'seized', 'power', 'and', 'warmed', 'to', 'moscow', 'in', 'recent', 'years']",['Mali Rebels Strike Major Blow Against Junta and Russia s Africa Corps Coordinated attacks signified a major escalation of insurgent violence in a region of West Africa where military leaders had seized power and warmed to Moscow in recent years'],"['mali', 'rebels', 'strike', 'major', 'blow', 'against', 'junta', 'and', 'russia', 's', 'africa', 'corps', 'coordinated', 'attacks', 'signified', 'a', 'major', 'escalation', 'of', 'insurgent', 'violence', 'in', 'a', 'region', 'of', 'west', 'africa', 'where', 'military', 'leaders', 'had', 'seized', 'power', 'and', 'warmed', 'to', 'moscow', 'in', 'recent', 'years']","['mali', 'rebels', 'strike', 'major', 'blow', 'junta', 'russia', 'africa', 'corps', 'coordinated', 'attacks', 'signified', 'major', 'escalation', 'insurgent', 'violence', 'region', 'west', 'africa', 'military', 'leaders', 'seized', 'power', 'warmed', 'moscow', 'recent', 'years']","['mali', 'rebel', 'strike', 'major', 'blow', 'junta', 'russia', 'africa', 'corp', 'coordinated', 'attack', 'signified', 'major', 'escalation', 'insurgent', 'violence', 'region', 'west', 'africa', 'military', 'leader', 'seized', 'power', 'warmed', 'moscow', 'recent', 'year']","['mali', 'rebel', 'strike', 'major', 'blow', 'junta', 'russia', 'africa', 'corp', 'coordin', 'attack', 'signifi', 'major', 'escal', 'insurg', 'violenc', 'region', 'west', 'africa', 'militari', 'leader', 'seiz', 'power', 'warm', 'moscow', 'recent', 'year']","['mali', 'rebel', 'strike', 'major', 'blow', 'junta', 'russia', 'africa', 'corp', 'coordin', 'attack', 'signifi', 'major', 'escal', 'insurg', 'violenc', 'region', 'west', 'africa', 'militari', 'leader', 'seiz', 'power', 'warm', 'moscow', 'recent', 'year']"
New York Times,2026-04-28,The Art of the Nuclear Deal,President Trump ripped up a pact designed to prevent Iran from building a bomb. Getting a better agreement now could prove difficult.,The Art of the Nuclear Deal President Trump ripped up a pact designed to prevent Iran from building a bomb. Getting a better agreement now could prove difficult.,The Art of the Nuclear Deal President Trump ripped up a pact designed to prevent Iran from building a bomb Getting a better agreement now could prove difficult,the art of the nuclear deal president trump ripped up a pact designed to prevent iran from building a bomb getting a better agreement now could prove difficult,"['the', 'art', 'of', 'the', 'nuclear', 'deal', 'president', 'trump', 'ripped', 'up', 'a', 'pact', 'designed', 'to', 'prevent', 'iran', 'from', 'building', 'a', 'bomb', 'getting', 'a', 'better', 'agreement', 'now', 'could', 'prove', 'difficult']",['The Art of the Nuclear Deal President Trump ripped up a pact designed to prevent Iran from building a bomb Getting a better agreement now could prove difficult'],"['the', 'art', 'of', 'the', 'nuclear', 'deal', 'president', 'trump', 'ripped', 'up', 'a', 'pact', 'designed', 'to', 'prevent', 'iran', 'from', 'building', 'a', 'bomb', 'getting', 'a', 'better', 'agreement', 'now', 'could', 'prove', 'difficult']","['art', 'nuclear', 'deal', 'president', 'trump', 'ripped', 'pact', 'designed', 'prevent', 'iran', 'building', 'bomb', 'getting', 'better', 'agreement', 'could', 'prove', 'difficult']","['art', 'nuclear', 'deal', 'president', 'trump', 'ripped', 'pact', 'designed', 'prevent', 'iran', 'building', 'bomb', 'getting', 'better', 'agreement', 'could', 'prove', 'difficult']","['art', 'nuclear', 'deal', 'presid', 'trump', 'rip', 'pact', 'design', 'prevent', 'iran', 'build', 'bomb', 'get', 'better', 'agreement', 'could', 'prove', 'difficult']","['art', 'nuclear', 'deal', 'presid', 'trump', 'rip', 'pact', 'design', 'prevent', 'iran', 'build', 'bomb', 'get', 'better', 'agreement', 'could', 'prove', 'difficult']"
